Left context;Center;Right context;Created;Sphere;Type;Full context;Left_context_POS;Right_context_POS
в 1787 году императрица увидела;аки;бы по мановению волшебного жезла возникшие ;1980;нехудожественная;публицистический;Здесь в 1787 году императрица увидела аки бы по мановению волшебного жезла возникшие укрепления, до четырехсот домов, склады, верфь и сильную духом моряков, юную эскадру. [Д. С. Лихачев. Крещение Руси и государство Русь (1988)] [омонимия не снята];VERB;AUX
хочешь ― по речке пробегись,;аки;посуху, хочешь ― волка в нору загони, ;1930;художественная;научный;Хочешь ― по речке пробегись, аки посуху, хочешь ― волка в нору загони, хочешь ― в сыроежку брызни, чтобы знакомого зайца чистой водицей угостить. [Н. К. Гудзий. История древней русской литературы. (XVI-XVII вв.) (1938)] [омонимия не снята];VERB;ADVB
том здесь небольшое время терпеть, ―;аки;оком мигнуть, так и душа выскочит.;1830;нехудожественная;разговорный;Протопоп же Аввакум предлагал поэту иное: « А в огне том здесь небольшое время терпеть, ― аки оком мигнуть, так и душа выскочит. [П. В. Киреевский. Письма Н. М. Языкову (1833)] [омонимия не снята];VERB;NOUN
сотворших милости единому от малых,;аки;себе самому не сотворших осуждает, то ;1860;художественная;публицистический;Аще не сотворших милости единому от малых, аки себе самому не сотворших осуждает, то како осудит наветующих на наместника своего, имени божия участника, христа господня?  [А. И. Левитов. Московские «комнаты снебилью» (1863)] [омонимия не снята];NOUN;NPRO
их зловерию, с правоверными христианами,;аки;исповедовавшихся и причастившихся писати не стану.;1700;нехудожественная;разговорный;О неисправляющихся же и во упорстве своем пребывающих, паче же о развратниках, и других от соединения церкве отвлекающих, куды надлежит, письменно и словесно представляти буду: а кольми паче в книгах исповедных, закрывая и поблажая их зловерию, с правоверными христианами, аки исповедовавшихся и причастившихся писати не стану. [архиепископ Феофан (Прокопович). Слово похвальное о преславной над войсками свейскими победе, пресветлейшему государю царю и великому князю Петру Алексиевичу (1709)] [омонимия не снята];NOUN;PRT_GRND
мог переправиться на остров пешком, «;аки;по суху».  ;1900;нехудожественная;публицистический;В некоторых местах расстояние между Пелопоннесом и Поросом составляет всего триста метров, и, по свидетельству древнего автора Павсания, любой желающий мог переправиться на остров пешком, « аки по суху».   [Л. Н. Толстой. Закон насилия и закон любви (1908)] [омонимия не снята];ADVB;AUX
за выселение чеченского лагеря в;аки;юрте: ильясов в бытность главой правительства ;1880;нехудожественная;публицистический;И Юнаш, и Ильясов так или иначе несут ответственность за выселение чеченского лагеря в Аки-Юрте: Ильясов в бытность главой правительства ЧР не раз повторял, что беженцы должны поскорее вернуться в Чечню, а Юнаш лично присутствовал в Ингушетии в тот период, когда выселяли лагерь, и уверял, что все уезжали добровольно.   [В. И. Немирович-Данченко. Святые горы (1880)] [омонимия не снята];AUX;NOUN
хребту сягати вервием, изгна всех,;аки;"зверей дивиих из дому божия; ревность, ";1860;нехудожественная;публицистический;"Такую ревность явил и сам Христос, Спаситель наш: видит, что оные беззаконницы дом Божий в разбойничь вертеп измениша, и сотворивши бич от вервий, начнет их гораздо по хребту сягати вервием, изгна всех, аки зверей дивиих из дому Божия; ревность, рече, дому твоего снеде мя. [В. А. Слепцов. Владимирка и Клязьма (1860-1861)] [омонимия не снята]";ADJ;VERB
мячик, тоша восстал возле графина,;аки;лев рыкающий.  ;2010;художественная;художественный;Пока ученый человек соображал, какой лаптой отбить дедов мячик, Тоша восстал возле графина, аки лев рыкающий.   [Борис Евсеев. Евстигней // «Октябрь», 2010] [омонимия не снята];NOUN;ADJ
т. е. кувалдочку) и прыгнул;аки;лев на контрабудку.;1972;художественная;художественный;Я бросил свое “ сало” ( т. е. кувалдочку) и прыгнул аки лев на контрабудку. [Ю. М. Нагибин. Остров любви (1972-1979)] [омонимия не снята];VERB;ADJ
окоянни же то видевше, устремишась,;аки;зверие, диви».;1970;нехудожественная;художественный;Окоянни же то видевше, устремишась, аки зверие, диви». [Коллекция анекдотов: религиозная тематика (1970-2000)] [омонимия не снята];PRT_GRND;NOUN
индийского царя авенира, « воспитан бе;аки;в некоем затворе»: отец не выпускал ;1910;нехудожественная;художественный;Иасаф, сын индийского царя Авенира, « воспитан бе аки в некоем затворе»: отец не выпускал сына за пределы чудно устроенного дворца, чтобы тот не знал, не ведал о страданиях, скорбях, муках земной жизни. [Ф. Д. Крюков. Счастье // «Русское Богатство», 1911] [омонимия не снята];TRSH;AUX
како в сухим костем;аки;"к живым глаголет; и по словеси ";1871;художественная;художественный;"како в сухим костем аки к живым глаголет; и по словеси том глаголет пророк: и видех, и се быша им жилы, и плоть растяше, и восхождаше и протяжеся на них кожа, и вниде в ня дух и ожиша. [П. И. Мельников-Печерский. В лесах. Книга вторая (1871-1874)] [омонимия не снята]";NOUN;AUX
27 на тех же;аки;перстом показует павел, учя в посланиях ;1860;художественная;публицистический;27 На тех же аки перстом показует Павел, учя в посланиях своих покорятися властем, яко же послежде увидим.   [А. И. Левитов. Московские «комнаты снебилью» (1863)] [омонимия не снята];AUX;NOUN
черный,;аки;мурин, и весь из цельного куска ;1990;нехудожественная;публицистический;Черный, аки мурин, и весь из цельного куска слеплен. [Анатолий Турилов, Алексей Чернецов. Книга Рафли // «Родина», 1996] [омонимия не снята];NOUN;NOUN
оконную раму и хлопали крыльями,;аки;орлы.;2000;нехудожественная;публицистический;Во время совокупления ― скребли когтями по жести, горланили « лебединые песни», сотрясали оконную раму и хлопали крыльями, аки орлы. [Юрий Архипов. Назову себя шахматистом… // «64 — Шахматное обозрение», 2004.05.15] [омонимия не снята];NOUN;NOUN
все создание и вся тварь,;аки;от сна возбуждшися, начат оживотворятися.  ;1871;художественная;художественный;Не воспоминаю ныне о предшедшей печали приснодевы Марии, яже яко нестерпимая бяше, сице и радость ея, егда увиде Сына своего воскресшаго, всякое слово превосходит: словом единым заключаю, яко сим торжественным приветом все создание и вся тварь, аки от сна возбуждшися, начат оживотворятися.   [П. И. Мельников-Печерский. В лесах. Книга вторая (1871-1874)] [омонимия не снята];NOUN;AUX
коль же срамно потемнеют грешницы;аки;углие! ;1871;художественная;художественный;О коль же срамно потемнеют грешницы аки углие!  [П. И. Мельников-Печерский. В лесах. Книга вторая (1871-1874)] [омонимия не снята];NOUN;NOUN
чем в хождении по воде;аки;по суху.;2000;нехудожественная;художественный;В этом как-то больше жизненного восторга, чем в хождении по воде аки по суху. [Екатерина Романова, Николай Романов. Дамы-козыри (2002)] [омонимия не снята];NOUN;AUX
се корабли фарсистiи;аки;облицы къ тебѣ летятъ, и яко ;1850;художественная;художественный;Се корабли фарсистiи аки облицы къ тебѣ летятъ, и яко голуби со птенцы своими. [А. Ф. Писемский. Тысяча душ (1858)] [омонимия не снята];NOUN;NOUN
отец протопоп видел, говорит: «;аки;бы звезды во мраке сияют, когда ;1760;нехудожественная;разговорный;"Отец протопоп видел, говорит: « аки бы звезды во мраке сияют, когда он вращается», а учение бросил, ― вот я его теперь за все сразу и проучу ― и за краткий сюртук, и за плясание, и за камзельку с стекловидными пуговками, да… вот я его, скакуна, усмирю… да; я возьму его да на тебе и женю. [архиепископ Платон (Левшин). Слово в неделю мытаря и фарисея (1764)] [омонимия не снята]";VERB;AUX
понеже вопервых то не истинно,;аки;бы святая маккавеев мать сама в ;1850;нехудожественная;разговорный;Но сия ваша отговорка к защищению вашему не служит: понеже вопервых то не истинно, аки бы святая Маккавеев мать сама в огнь бросилась. [И. В. Киреевский. Письма оптинскому старцу Макарию (1853)] [омонимия не снята];ADVB;AUX
но « что-то;аки;мгла, затмевало ее, и луна поколебалась».;1910;нехудожественная;художественный;Но « что-то аки мгла, затмевало ее, и луна поколебалась». [Ф. Д. Крюков. Счастье // «Русское Богатство», 1911] [омонимия не снята];NPRO;NOUN
прежде было грубое, неискусное, и;аки;бы сумрачное, но ныне всему свету ;1840;художественная;художественный;Но Новый сей Царствующий Град новое себе жителство возымел, то и жителям своим новыя регулы, новыя вежества и искуства, во всем иное и лучшее учредил, так что от прежних времен весма ныне во всем отмененное, прежде было грубое, неискусное, и аки бы сумрачное, но ныне всему свету стало быть приятное, ласковое, и уветливое, так что все приежжающия от всех российских городов всякия люди [А. Ф. Вельтман. Райна, королева болгарская (1843)] [омонимия не снята];AUX;AUX
анфиза наша мудра,;аки;змея, и чиста ― ну хоть и ;1900;художественная;художественный;Анфиза наша мудра, аки змея, и чиста ― ну хоть и не аки голубица, однако ж и не уступала в том целомудрейшим девам, воспитывающимся в нашей обители. [Андрей Белый. Симфония (1901)] [омонимия не снята];ADJ;NOUN
а с ними стала мудрой,;аки;змий, и узнала столько величии и ;2000;нехудожественная;публицистический;А с ними стала мудрой, аки змий, и узнала столько величии и низости человека, что не снилось, не мерещилось всем ее норвежским сверстницам. [Александр Клейн. 108 + свастика = Солнце? // «Пятое измерение», 2002] [омонимия не снята];ADJ;NOUN
безпечальнаго онаго уже доплывши брега,;аки;обратившеся, посматривают на море житейское и ;2010;нехудожественная;публицистический;Обаче не усумневаюся, яко святии угодницы божии, безпечальнаго онаго уже доплывши брега, аки обратившеся, посматривают на море житейское и нас, братию свою, волнящыхся еще и бедствующих видят, не так своих себе от нас похвал хотят, суще от самаго славы господа прославлении, ― яко тогожде нам блаженства желают, которое они получили, сиесть наследования живота вечнаго. [коллективный. Форум: В жижечке очередная истерия по поводу ЮЮ... Обсуждение (2012)] [омонимия не снята];NOUN;PRT_GRND
и до сего дне: погибоша;аки;обре, их же несть племени, ни ;1840;художественная;разговорный;"Быша же обре телом велици и умом горди, и Бог потреби я, помроша все, и не остася ни един обрин; есть притьча в Руси и до сего дне: погибоша аки обре, их же несть племени, ни наследъка».   [А. А. Фет. Письма И. П. Борисову (1849)] [омонимия не снята]";NOUN;NOUN
править не указано, так бояре,;аки;псы ощетинясь, рекли, что- де сие ;1990;нехудожественная;публицистический;Так вот, когда я отвечал боярам, ― продолжал он, не давая говорить хозяйке, ― что мне того в посольстве править не указано, так бояре, аки псы ощетинясь, рекли, что- де сие великому государю вельми грубо ― не в истерп- де воля новгородская и что- де и великий государь тебе, Василиюпосаднику, указал ответ ево, государев, держать, Великому Новуграду, аркучу тако: « Исправьтесь- де и, отчина моя, Великий Новгород [Рустам Арифджанов. Крещение // «Столица», 1997.12.22] [омонимия не снята];NOUN;NOUN
своего служения, долг всеусердия моего,;аки;принося во всеоблаготворение человечеству жертву благоговения, ;1750;нехудожественная;научный;А как усердие мое во благо роду смертных никогда еще не угасало, а угаснет разве с жизнью, то жаждая, сколь есть всевозможности моей, воздавать по чреде своего служения, долг всеусердия моего, аки принося во всеоблаготворение человечеству жертву благоговения, тяжкими трудами моими и наукою самопрактическою приобретенную, ― посему за   [А. И. Богданов. Описание Санктпетербурга (1751)] [омонимия не снята];ADJ;PRT_GRND
"твоих; тако устремлен к странствованию,";аки;бы ему речено было: « поступи в ;1930;художественная;художественный;"Не у брега мешкает и твой Петр, Россие, но в глубине ищет корыстей твоих; тако устремлен к странствованию, аки бы ему речено было: « поступи в глубину». [Б. В. Шергин. Пронька Грезной (1930-1960)] [омонимия не снята]";NOUN;AUX
иоанн дамаскин пишет: « мощи святых;аки;спасительные источники дарова нам владыка христос, ;2000;художественная;художественный;Преподобный Иоанн Дамаскин пишет: « Мощи святых аки спасительные источники дарова нам Владыка Христос, яже многоразличная благодеяния источают». [Сергей Гандлевский. НРЗБ // «Знамя», 2002] [омонимия не снята];ADJ;ADJ
множае гордишися и превозношаешися, рыкаеши,;аки;лев, и лукавьствуеши, яко бес, и ;1710;художественная;разговорный;Обличая в двенадцатом « Слове» похотливых развратников, Даниил говорит о них: « Ты же обиадаешися, яко скот, и пианствуеши день и нощь, многажды и до блевания, якоже и главою болети и умом пленитися… и паче множае гордишися и превозношаешися, рыкаеши, аки лев, и лукавьствуеши, яко бес, и на диавольская позорища течеши, яко свинопас». [архиепископ Феофан (Прокопович). Слово похвалное о баталии Полтавской (1717)] [омонимия не снята];VERB;ADJ
в своей клетчатой потертой рубахе;а-ля;ковбой.  ;1990;художественная;художественный;Все-таки он удивительно симпатичный, этот Саша, в своей клетчатой потертой рубахе а-ля ковбой.   [Сергей Довлатов. Переводные картинки // «Иностранная литература», 1990] [омонимия снята];NOUN;NOUN
нужное время раскрыться, от руки,;а-ля;прима, раскрашенная;1926;нехудожественная;публицистический;Вырезанная грубовато, с обобщенными, весьма условными очертаниями, но зато и по-своему выразительная, наподобие народной игрушки русской, из цельного куска дерева, да вдобавок еще и наивно, по-детски, в два- три цвета, но тоже ведь выразительно, завершая весь образ легко и свободно, что вообще поразительно, представление сразу давая о сути, рождая метафору, затаившуюся внутри, но готовую в нужное время раскрыться, от руки, а-ля прима, раскрашенная [В. А. Гиляровский. Москва и москвичи (1926-1934)] [омонимия не снята];NOUN;NOUN
почему вы привыкли пить чай «;а-ля;фуршет», ― засмеялась она.  ;2010;нехудожественная;разговорный;Теперь я понимаю, почему вы привыкли пить чай « а-ля фуршет», ― засмеялась она.   [коллективный. Форум: Отдых в Болгарии, отзывы (2013)] [омонимия не снята];VERB;NOUN
украшать пальто большим воротником- шалью «;а-ля;шаляпин» и… покупать очередную шубку любимой ;2013;нехудожественная;публицистический;За мужчинами сохраняется право носить пальто и плащи на меховой подстежке, украшать пальто большим воротником- шалью « а-ля Шаляпин» и… покупать очередную шубку любимой женщине.   [Анна Мельникова. Без джинсы (2013.05.17) // «Новгородские ведомости», 2013] [омонимия не снята];NOUN;NOUN
конце концов, небольшой кусочек забав;а-ля;церетели в виду петропавловки не такой ;2000;нехудожественная;публицистический;В конце концов, небольшой кусочек забав а-ля Церетели в виду Петропавловки не такой уж плохой обмен на голы Халка и Кержакова.   [Светлана Писарская: «Москва по сравнению с Шанхаем выглядит глубокой нецивилизованной провинцией» // «Мир & Дом. City», 2003.09.15] [омонимия не снята];NOUN;NOUN
