Left context;Center;Right context;Created;Sphere;Type;Full context;Left_context_POS;Right_context_POS
заключается в положении о том,;будто;объективная действительность непосредственно и сразу влияет ;1990;нехудожественная;научный;Он пишет: « Современная буржуазная психология, как мне кажется, целиком базируется на предварительно не проверенной, критически не осознанной, догматически воспринятой предпосылке, смысл которой заключается в положении о том, будто объективная действительность непосредственно и сразу влияет на сознательную психику и в этой непосредственной связи определяется ее деятельность» ( Узнадзе, 1966. [А. А. Девяткин. Явление социальной установки в психологии XX века (1999)] [омонимия не снята];ADJ;ADJ
те, которые живут, как;будто;они смертны, ― безнадежны.;2010;нехудожественная;публицистический;Те, которые живут, как будто они смертны, ― безнадежны. [А. А. Данилова, Ксения Кнорре-Дмитриева. Татьяна Друбич: У меня нет сверхидеи, что я спасаю человечество // 2017] [омонимия не снята];AUX;NPRO
агрономов с представителями университетской науки!;будто;наука не одна! ;1890;нехудожественная;разговорный;агрономов с представителями университетской науки! Будто наука не одна!  [А. А. Измаильский. Письмо В. В. Докучаеву (1894)] [омонимия не снята];NOUN;NOUN
потом растерянно глядит на меня ―;будто;сам удивился тому, что сказал.  ;1850;художественная;художественный;Потом растерянно глядит на меня ― будто сам удивился тому, что сказал.   [А. А. Потехин. Шуба овечья ― душа человечья (1854)] [омонимия не снята];NPRO;ADJ
иногда за меня и как;будто;любит…  ;1860;художественная;художественный;Одна Лизанька еще вступается иногда за меня и как будто любит…   [А. А. Потехин. Брак по страсти (1860-1870)] [омонимия не снята];AUX;TRSH
грустно раздается намаз,;будто;поминка по ясном дне, отлетевшем в ;1830;художественная;художественный;Грустно раздается намаз, будто поминка по ясном дне, отлетевшем в вечность.   [А. А. Бестужев-Марлинский. Мулла-Нур (1836)] [омонимия не снята];NOUN;NOUN
власть, по их словам,;будто;бы захватила « небольшая группа политических утопистов», ;1947;нехудожественная;публицистический;Власть, по их словам, будто бы захватила « небольшая группа политических утопистов», представлявшихся « Горой» времен французской революции. [А. А. Игнатьев. Пятьдесят лет в строю. Кн. 5 (1947-1953)] [омонимия не снята];NOUN;AUX
не могу согласиться с тем,;будто;восприятие является умственным действием.;1990;нехудожественная;научный;Имея в виду психологию актов Франца Брентано, которая стала предтечей феноменологии Гуссерля, Гибсон замечает, что « близкие идеи развивались в прошлом веке в психологии актов, но я не могу согласиться с тем, будто восприятие является умственным действием. [А. А. Девяткин. Явление социальной установки в психологии XX века (1999)] [омонимия не снята];AUX;NOUN
и бродячая жизнь как;будто;кончилась.;1957;нехудожественная;публицистический;и бродячая жизнь как будто кончилась. [А. А. Ахматова. Листки из дневника: воспоминания об О. Э. Мандельштаме (1957-1964)] [омонимия не снята];AUX;VERB
тартыге это не приятно, ― как;будто;он провинился в чем-нибудь дурном, и ;1910;художественная;художественный;Тартыге это не приятно, ― как будто он провинился в чем-нибудь дурном, и маленьким червячком сосет внутри желание расположить в свою пользу мужиков… [А. А. Богданов. Перед рассветом (1913)] [омонимия не снята];AUX;NPRO
"облиты божьей позолотой; море сверкает";будто;зеркало.;1830;художественная;художественный;"Горы облиты Божьей позолотой; море сверкает будто зеркало. [А. А. Бестужев-Марлинский. Мулла-Нур (1836)] [омонимия не снята]";VERB;NOUN
исключительно для нее самой, как;будто;бы в ней заключалась вся сущность ;1890;нехудожественная;публицистический;Видно, что во все времена и во все эпохи,  ― как только человек начнет с любовью смотреть на предмет или на мысль свою и воспроизводить ее не в соотношении к другим предметам, но исключительно для нее самой, как будто бы в ней заключалась вся сущность мира,  ― так непременно явится произведение, которое невольно притягивает к себе всякого, у кого есть сколько-нибудь живое чувство. [А. А. Фет. Ранние годы моей жизни (1891)] [омонимия не снята];AUX;AUX
появилось в его лице, как;будто;понял он душой какую-то большую и ;1900;художественная;художественный;Торжественное и светлое появилось в его лице, как будто понял он душой какую-то большую и новую правду, которой не знал раньше.   [А. А. Богданов. Смерти нет (1908)] [омонимия не снята];AUX;VERB
и действительно, маленькие крохалятки сначала;будто;испугались незнакомой им еще среды, все ;1840;нехудожественная;разговорный;И действительно, маленькие крохалятки сначала будто испугались незнакомой им еще среды, все жалобно запикали, а потом замолкли и начали плескаться и бить по воде куцыми крылышками…   [А. А. Фет. Письма И. П. Борисову (1849)] [омонимия не снята];ADVB;VERB
проговорил я таким тоном, как;будто;сторицею платил до последней копейки старый ;1860;нехудожественная;публицистический;Дублин, Портсмут, Плимут, Ярмут ― портовые города, ― проговорил я таким тоном, как будто сторицею платил до последней копейки старый долг, а « портовые города» произнес на этот раз так, что всякий посторонний подумал бы: « Да чего же он еще хочет от дитяти?  [А. А. Фет. Из деревни. 2 (1864)] [омонимия не снята];AUX;ADVB
потной головой и, слушая идущие;будто;из-под земли толчки чужого неугомонного сердца, ;2000;художественная;художественный;А исчерпав последние, приткнулся в траву взлохмаченной потной головой и, слушая идущие будто из-под земли толчки чужого неугомонного сердца, заснул.   [А. А. Старобинец. Живые (2005)] [омонимия не снята];PRT_GRND;AUX
позволять им хозяйничать у нас,;будто;в своем кармане? ;1830;художественная;художественный;Что позволять им хозяйничать у нас, будто в своем кармане?  [А. А. Бестужев-Марлинский. Аммалат-бек (1831)] [омонимия не снята];NPRO;AUX
березки как;будто;передавая ему альбом, сказал я.;1920;нехудожественная;публицистический;Березки как будто, ― передавая ему альбом, сказал я. [M. П. Мурашев. Сергей Есенин (1926)] [омонимия не снята];AUX;PRT_GRND
основано на том правиле, что;будто;б то только правление и хорошо ;1820;нехудожественная;деловой;2) Мнение общества, как из списка усмотреть изволите, основано на том Правиле, что будто б то только Правление и хорошо и там только народы благоденствуют, где Царствующая особа и окружающие ее суть Масоны.   [А. А. Волков. Донесение (1827)] [омонимия не снята];AUX;AUX
говорили ― правда ли, нет ли, ―;будто;ты земского боровом обозвал…;1910;художественная;художественный;Говорили ― правда ли, нет ли, ― будто ты земского боровом обозвал… [А. А. Богданов. Перед рассветом (1913)] [омонимия не снята];AUX;NPRO
ты ушла молчаливо, // принарядившись, как;будто;к венцу…» ;1883;художественная;художественный;Ты ушла молчаливо, // Принарядившись, как будто к венцу…»  [А. А. Черкасов. Разбойник (1883-1887)] [омонимия не снята];AUX;AUX
гете толкуют, как;будто;"он был непонятен; а байроном восхищаются, ";1820;нехудожественная;публицистический;"Гете толкуют, как будто он был непонятен; а Байроном восхищаются, не понимая его в самом деле. [А. А. Бестужев. Знакомство мое с А. С. Грибоедовым (1829)] [омонимия не снята]";AUX;NPRO
как;будто;наше уважение к великому человеку уменьшится ;1980;художественная;художественный;как будто наше уважение к великому человеку уменьшится от того, что ему необходимо было самому сознать необходимость истины, прежде чем показать ее свету).   [А. А. Образцов. Магнитные поля (1980-1995)] [омонимия не снята];AUX;ADJ
"к тому франту; она как";будто;хочет сказать: да какое вы имеете ;1980;художественная;художественный;"Недаром она делает большие глаза, выражает изумление и сердится, когда я упрекаю ее за излишнюю любезность и внимательность к тому франту; она как будто хочет сказать: да какое вы имеете право врываться в мою душу, анализировать мои чувства, осуждать мои намерения… [А. А. Образцов. Отцовская жилка (1980-1995)] [омонимия не снята]";AUX;VERB
имѣется одно мемуарное отступленіе, как-;будто;вѣрно передающее настроеніе нѣкоторых кругов демократіи: « ;1940;нехудожественная;научный;В « записках» Суханова имѣется одно мемуарное отступленіе, как- будто вѣрно передающее настроеніе нѣкоторых кругов демократіи: « я даже немного опасался, как бы вопрос о династіи не вытѣснил в порядкѣ дня проблему власти, разрѣшавшуюся совершенно независимо от судьбы Романовых. [C. П. Мельгунов. Мартовскіе Дни 1917 года (1940-1954)] [омонимия не снята];AUX;NOUN
верховского, в таком положении, как;будто;он упал набок и затем опрокинулся ;1883;художественная;художественный;Драпри было приподнято вверх, и на полу, около кровати, на подножном ковре, широко пропитанном целою лужею крови, в особенности там, где было туловище, лежал закутанный в одеяло труп Верховского, в таком положении, как будто он упал набок и затем опрокинулся лицом кверху. [А. А. Черкасов. Сломанная сошка (1883-1887)] [омонимия не снята];AUX;NPRO
оглянулся и… раздался такой звук,;будто;кто-то вытянул ногу из мокрой глины.;1960;художественная;художественный;Чок потянул носом, подошел к бекасу, оглянулся и… раздался такой звук, будто кто-то вытянул ногу из мокрой глины. [А. А. Ливеровский. Журавлиная родина. Рассказы охотника (1966)] [омонимия не снята];NOUN;NPRO
англичане;будто;бы обязывались в случае войны послать ;1947;нехудожественная;публицистический;Англичане будто бы обязывались в случае войны послать во Францию экспедиционный корпус. [А. А. Игнатьев. Пятьдесят лет в строю. Кн. 3 (1947-1953)] [омонимия не снята];NOUN;AUX
значит, неправда,;будто;по словам г. миловидова, г. потебня ;1870;нехудожественная;публицистический;"Значит, неправда, будто,по словам г. Миловидова, г. Потебня не даёт определения предложения и только ( далеко― не только!) говорит, что "" история языка на значительном протяжении времени должна давать целый ряд определений предложения"".   [А. А. Дмитриевский. Еще несколько слов о второстепенности подлежащего // «Филологические записки», вып. 3, 1878] [омонимия снята]";NOUN;AUX
тот выслушивает его и как;будто;соглашается, но через несколько часов, вернувшись ;1947;нехудожественная;публицистический;Тот выслушивает его и как будто соглашается, но через несколько часов, вернувшись из Гатчинского дворца в Петербург, Николай Павлович получил собственноручную записку Александра III: « Взвесив нашу утреннюю беседу, я пришел к убеждению, что вместе мы служить России не можем. [А. А. Игнатьев. Пятьдесят лет в строю. Кн. 1-2 (1947-1953)] [омонимия не снята];AUX;VERB
ничего особого… как;будто;жар… сон…  ;1883;художественная;художественный;Ничего особого… как будто жар… сон…   [А. А. Черкасов. Шахтама (1883-1887)] [омонимия не снята];AUX;TRSH
рука ее сжимала лоб, как;будто;от сильной головной боли, левая упала ;1840;нехудожественная;публицистический;"Когда я вошел нынче, она сидела спиною к дверям или, лучше сказать, лежала на креслах, на которых обыкновенно садится ее муж, так, что ее локоны выходили за спинку кресел; правая рука ее сжимала лоб, как будто от сильной головной боли, левая упала на ручку кресел. [А. А. Григорьев. Человек будущего (1845)] [омонимия не снята]";AUX;AUX
сладились крупною рысью, что казалось,;будто;такт отбивают ноги одной.;1920;художественная;художественный;Коляска бежала, как по шоссе, и лошади до того сладились крупною рысью, что казалось, будто такт отбивают ноги одной. [А. А. Фадеев. Рождение Амгуньского полка (1923)] [омонимия не снята];AUX;NOUN
более скрепив сердце, притворялся равнодушным,;будто;читал книгу, но, конечно, не видал ;1840;нехудожественная;разговорный;Тут я, еще более скрепив сердце, притворялся равнодушным, будто читал книгу, но, конечно, не видал строчек, ничего не понимал, и меня давила особая истома.   [А. А. Фет. Письма И. И. Введенскому (1840)] [омонимия не снята];ADJ;VERB
вино деловито и просто, ка;будто;ел хлеб с водой.;1970;художественная;художественный;Он пил вино деловито и просто, кА будто ел хлеб с водой. [O. М. Куваев. Эй, Бако! (1975)] [омонимия не снята];TRSH;VERB
в себе содрогания, ― казалось, как;будто;я вырос в этом, как будто ;1830;нехудожественная;разговорный;Возвращаясь по полю, усеянному мертвыми телами, разумеется обнаженными, и видя иных еще дышащими, с запекшеюся кровью на устах и лице, видя всюду грабеж, насилие, пожар ― словом, все ужасы, сопровождающие приступ и битву, я удивлялся, не чувствуя в себе содрогания, ― казалось, как будто я вырос в этом, как будто это должно было так быть: как скоро привыкает человек к этим картинам. [А. А. Бестужев-Марлинский. Письма (1830-1837)] [омонимия не снята];AUX;NPRO
могло в наступающих сумерках привидеться,;будто;это большой птенец какой-то чудной птицы ;1980;художественная;художественный;Острые его локотки, все в подживающих ссадинах, вздрагивали от безутешного рыдания и издали, с того берега реки, могло в наступающих сумерках привидеться, будто это большой птенец какой-то чудной птицы выпал из гнезда и теперь силится взлететь, качаясь на куцых палках ножек и взмахивая малюсенькими, еще голыми начатками крыльев. [А. А. Образцов. Все кошки серы (1980-1995)] [омонимия не снята];VERB;AUX
каленые ветры и палящее солнце,;будто;нарочно, чтобы оттенить физическую природу каждой ;1960;нехудожественная;публицистический;Донецкие каленые ветры и палящее солнце, будто нарочно, чтобы оттенить физическую природу каждой из девушек, у той позолотили, у другой посмуглили, а у иной прокалили, как в огненной купели, руки и ноги, лицо и шею до самых лопаток.   [А. А. Реформатский. Принципы синхронного описания языка (1960-1970)] [омонимия не снята];NOUN;ADVB
касающиеся нашего переезда в квартиру:;будто;бы муфтиев считает себя страшно обиженным ;1900;нехудожественная;публицистический;Незадолго до обеда пришла мама от Барановых и рассказала, что в институте ходят разные сплетни, касающиеся нашего переезда в квартиру: будто бы Муфтиев считает себя страшно обиженным и рассказывает про нас разные небылицы.   [А. А. Аллендорф. Дневник (1909)] [омонимия не снята];NOUN;AUX
так неприглядно, что не верилось,;будто;на этой заброшенной станции находится главный ;1943;художественная;художественный;Везде было так пустынно, так неприглядно, что не верилось, будто на этой заброшенной станции находится главный мозг фронта. [А. А. Фадеев. Молодая гвардия (1943-1951)] [омонимия не снята];VERB;AUX
