Left context;Center;Right context;Created;Sphere;Type;Full context;Left_context_POS;Right_context_POS
силе, все же сказала нерешительно,;словно;виновато:   ;1930;художественная;художественный;Но, повинуясь какой-то неодолимой смутной силе, все же сказала нерешительно, словно виновато:    [А. А. Богданов. Федор Шуруп (1930)] [омонимия не снята];ADVB;ADVB
опять ― тоска, тоска и пытка, ―;словно;в журавлиный перелет.   ;1930;нехудожественная;публицистический;И опять ― тоска, тоска и пытка, ― Словно в журавлиный перелет.    [А. И. Батюто. Дневник (1938)] [омонимия не снята];NOUN;AUX
здания слеплены из глины и;словно;подернуты сероватой дымкою: печальный вид…  ;1840;нехудожественная;разговорный;"Город велик и хорошо укреплен; но все здания слеплены из глины и словно подернуты сероватой дымкою: печальный вид…   [А. Д. Салтыков. Письма из Индии (1843)] [омонимия не снята]";AUX;PRT_GRND
красивее будет, не то что;словно;сонная набрана.  ;1862;нехудожественная;публицистический;В товаре- то она и красивее будет, не то что словно сонная набрана.   [А. А. Фет. Мои воспоминания / Часть I (1862-1889)] [омонимия не снята];AUX;ADJ
и сразу обе машины ринулись,;словно;спасаясь, ― и сразу рухнуло гиком, засвистело ;1920;художественная;художественный;"И сразу обе машины ринулись, словно спасаясь, ― и сразу рухнуло гиком, засвистело сзади и заревело тысячами горл; отставшие неслись, нахлестывая лошадей, на автомобили, на близкий дымок. [А. Г. Малышкин. Падение Даира (1923)] [омонимия не снята]";VERB;PRT_GRND
они здесь все чистенькие, нарядные,;словно;женихи.;1920;нехудожественная;публицистический;Какие они здесь все чистенькие, нарядные, словно женихи. [А. А. Яблоновский. Египет (1920-1921). Гости английского короля (1920-1921)] [омонимия не снята];ADJ;NOUN
здесь,;словно;солнце, сияли два огромных самовара, вдоль ;1970;нехудожественная;публицистический;Здесь, словно солнце, сияли два огромных самовара, вдоль стен за длинными столами сидели колхозники, пили чай, неторопливо беседовали, читали газеты.   [А. Голиков. Здесь жил веселый мудрец // «Огонек». № 5, 1970] [омонимия не снята];ADVB;NOUN
решетка,  и оснеженный ленинград возникли,;словно;в книге этой из мглы магических ;1960;нехудожественная;публицистический;И сада Летнего решетка,  И оснеженный Ленинград Возникли, словно в книге этой Из мглы магических зеркал,  И над задумчивою Летой Тростник оживший зазвучал. [А. А. Ахматова. Михаил Лозинский (1965)] [омонимия не снята];VERB;AUX
мы никак не могли проснуться,;словно;предчувствуя навалившееся на нас тяжелое горе.;1960;нехудожественная;публицистический;Мы никак не могли проснуться, словно предчувствуя навалившееся на нас тяжелое горе. [А. А. Есенина. Родное и близкое (1960-1979)] [омонимия не снята];VERB;PRT_GRND
она,;словно;клад, не давалась мне в руки.;1830;художественная;художественный;Она, словно клад, не давалась мне в руки. [А. А. Бестужев-Марлинский. Латник (1832)] [омонимия не снята];NPRO;NOUN
пахнет, ― мне делается так больно,;словно;все это уже ушло от меня ;1943;художественная;художественный;Когда я слышу это и вижу небо, такое ясное, вижу ветви деревьев, траву под ногами, чувствую, как ее нагрело солнышко, как она вкусно пахнет, ― мне делается так больно, словно все это уже ушло от меня навсегда, навсегда, ― грудным волнующимся голосом заговорила Уля. [А. А. Фадеев. Молодая гвардия (1943-1951)] [омонимия не снята];ADVB;ADJ
"предвкушая отдыхъ; наши вторятъ имъ;";словно;тяжелая кавалерія, возсѣдающая на какихъ- то ;1880;нехудожественная;публицистический;"Все ближе и ближе придвигается караванъ; верблюды его уже фыркаютъ, какъ бы предвкушая отдыхъ; наши вторятъ имъ; словно тяжелая кавалерія, возсѣдающая на какихъ- то чудовищныхъ коняхъ, несется прямо на насъ нѣсколько десятковъ арабовъ. [А. В. Елисеев. Мусульманские паломники // Вестник Европы, 1884] [омонимия не снята]";TRSH;ADJ
три на меня взглянула так,;словно;умела что-то видеть сквозь меня, не ;1940;нехудожественная;публицистический;Дина раза три на меня взглянула так, словно умела что-то видеть сквозь меня, не интересуясь мной. [А. И. Батюто. Дневник (1944)] [омонимия не снята];AUX;VERB
удивленно поймал он сам себя,;словно;впервые услышал это слово.;1910;художественная;художественный;Удивленно поймал он сам себя, словно впервые услышал это слово. [А. А. Богданов. Никита Простота (1915)] [омонимия не снята];NPRO;ADVB
встречают луч, который подсекает их;словно;раскаленною косою.;1830;художественная;художественный;Посмотрите, как меньшие братья ваши, колоски, дрожат, бедняжки, без ветра, ломаются под кузнечиком, вытягивают головки, ― думают высосать из воздуха влагу, а встречают луч, который подсекает их словно раскаленною косою. [А. А. Бестужев-Марлинский. Мулла-Нур (1836)] [омонимия не снята];NPRO;PRT_GRND
наконец пробормотала она по слогам,;словно;так ей было легче справиться с ;2010;художественная;художественный;наконец пробормотала она по слогам, словно так ей было легче справиться с забвением, и снова замолчала.   [А. Г. Ермакова. Мамаиха (2010)] [омонимия не снята];NOUN;AUX
полупьяный народ стоял на берегу;словно;зачарованный.;1900;художественная;художественный;Полупьяный народ стоял на берегу словно зачарованный. [А. Е. Зарин. Кровавый пир (1901)] [омонимия не снята];NOUN;PRT_GRND
мое из уст официанта раздается;словно;боевая пушка, ― во мне занялся дух, ;1830;художественная;художественный;Имя мое из уст официанта раздается словно боевая пушка, ― во мне занялся дух, и на глаза упал туман, хоть подымай сигнал « Неясно вижу!»  [А. А. Бестужев-Марлинский. Фрегат «Надежда» (1833)] [омонимия не снята];VERB;ADJ
онисим ―;словно;"туча; горничная малаша ― вся в слезах; ";1900;художественная;художественный;"Онисим ― словно туча; горничная Малаша ― вся в слезах; мать ее, скотница, вопит, что кого-то погубили и так она не оставит, пойдет до самого губернатора; маменька валяется в обмороках и кричит, что Онисим ей не сын и видеть она его, беспутного, не желает; а папенька ходит по кабинету, палит трубку, разводит руками и бормочет:    [А. В. Амфитеатров. Фармазоны (из сборника «Бабы и дамы») (1900)] [омонимия не снята]";NOUN;NOUN
она не приветствовали друг друга,;словно;мы не расставались с последней встречи.;1890;художественная;художественный;Ни я, ни она не приветствовали друг друга, словно мы не расставались с последней встречи. [А. В. Амфитеатров. «Альфонс» (из сборника «Бабы и дамы») (1890-1900)] [омонимия не снята];NOUN;NPRO
как уставился на меня,;словно;сова какая.;1850;художественная;художественный;Как уставился на меня, словно сова какая. [А. В. Сухово-Кобылин. Свадьба Кречинского (1855)] [омонимия не снята];NPRO;NOUN
да, передо мной был;словно;остов странного, фантастического парохода.;1940;художественная;художественный;Да, передо мной был словно остов странного, фантастического парохода. [А. А. Бек. Талант (Жизнь Бережкова) / Части 1-3 (1940-1956)] [омонимия не снята];VERB;NOUN
водворилась какая-то жуткая, гнетущая тишина,;словно;в доме был покойник.;1920;нехудожественная;публицистический;По мере ухудшения положения стены его странно пустели и в них водворилась какая-то жуткая, гнетущая тишина, словно в доме был покойник. [А. И. Деникин. Очерки русской смуты. Том II. Борьба генерала Корнилова (1922)] [омонимия не снята];NOUN;AUX
скрипела так жалобно, так заунывно,;словно;оплакивала своего жильца, и лестница, едва ;1830;художественная;художественный;Старая дверь скрипела так жалобно, так заунывно, словно оплакивала своего жильца, и лестница, едва озаренная луною, казалось, вела прямо в преисподнюю. [А. А. Бестужев-Марлинский. Вечер на кавказских водах в 1824 году (1830)] [омонимия не снята];ADVB;VERB
барин- то и ничего,;словно;не его дело, но софия николаевна ;1850;художественная;художественный;Барин- то и ничего, словно не его дело, но София Николаевна расходилась, говорит, это дело Федьки- музыканта, он все пьян, откуда деньги берет. [А. И. Герцен. Поврежденный (1851)] [омонимия не снята];NPRO;AUX
ярко разодетой и оживленной публики,;словно;бы возносящейся в заоблачные выси, в ;2000;художественная;художественный;взлетали прозрачные стеклянные лифты, полные ярко разодетой и оживленной публики, словно бы возносящейся в заоблачные выси, в иные миры, где жизнь еще краше, чем на земле…   [А. Е. Рекемчук. Мамонты (2006)] [омонимия не снята];NOUN;AUX
и, приподняв брови и сморщившись,;словно;сам собирался чихнуть, пощекотал ею в ;1925;художественная;художественный;Хромой отыскал соломинку и, приподняв брови и сморщившись, словно сам собирался чихнуть, пощекотал ею в Пикином носу. [А. А. Фадеев. Разгром (1925-1926)] [омонимия не снята];PRT_GRND;ADJ
неожиданно перед ним вырос мымра,;словно;чутьем унюхав добычу.  ;1910;художественная;художественный;Неожиданно перед ним вырос Мымра, словно чутьем унюхав добычу.   [А. А. Богданов. Акриды (1913)] [омонимия не снята];NOUN;NOUN
важно бродилъ вокрутъ нашего становища,;словно;разыскивая притаившихся враговъ.  ;1880;нехудожественная;публицистический;Старикъ- арабъ, которому я далъ на ночь свою берданку, былъ очень польщенъ этимъ довѣріемъ и важно бродилъ вокрутъ нашего становища, словно разыскивая притаившихся враговъ.   [А. В. Елисеев. В долине Иордана // Русский вестник, 1886] [омонимия не снята];NOUN;PRT_GRND
вместе с тем каждому стало;словно;не по себе.;1910;художественная;художественный;Все кругом засмеялись, но вместе с тем каждому стало словно не по себе. [А. Е. Зарин. Живой мертвец (1915)] [омонимия не снята];VERB;AUX
стакана, но вода не выльется,;словно;удерживаемая тонкой плёнкой.;2000;нехудожественная;публицистический;Её уровень поднимется чуть выше краёв стакана, но вода не выльется, словно удерживаемая тонкой плёнкой. [А. Ефремкин. Лёгкая, как воздух, жидкая, как вода // «Наука и жизнь», 2008] [омонимия не снята];VERB;PRT_GRND
и,;словно;на помощь бледной нашей весне, падают ;1960;художественная;художественный;И, словно на помощь бледной нашей весне, падают и падают с неба на полую воду живые цветы.   [А. А. Ливеровский. Журавлиная родина. Рассказы охотника (1966)] [омонимия не снята];AUX;AUX
набиваю карман подлых тварей разных,;словно;раба какая-нибудь…  ;1903;художественная;художественный;Но если продажною быть, так уж пусть хоть в чистую ― сама собою торгую, а не набиваю карман подлых тварей разных, словно раба какая-нибудь…   [А. В. Амфитеатров. Марья Лусьева (1903-1927)] [омонимия не снята];ADJ;NOUN
все занимавшиеся на поляне солдаты,;словно;по сигналу, оставили ряды и побежали ;1920;нехудожественная;публицистический;Тотчас же все занимавшиеся на поляне солдаты, словно по сигналу, оставили ряды и побежали к колонне.   [А. И. Деникин. Очерки русской смуты. Том I. Крушение власти и армии (1921)] [омонимия не снята];NOUN;AUX
как мальчишка!..;словно;с любочкой и стыд умер!..;1880;художественная;художественный;Как мальчишка!.. Словно с Любочкой и стыд умер!.. [А. В. Амфитеатров. Двенадцатое января (из сборника «Бабы и дамы») (1886)] [омонимия не снята];NOUN;AUX
я- то, дура, любила его.;словно;сквозь сон слышала я.;1882;художественная;художественный;я- то, дура, любила его. словно сквозь сон слышала я. [А. В. Амфитеатров. Отравленная совесть (1882-1893)] [омонимия не снята];NPRO;AUX
ту же секунду звонкий удар,;словно;кто-то стукнул палкой по днищу, потряс ;1960;художественная;художественный;В ту же секунду звонкий удар, словно кто-то стукнул палкой по днищу, потряс нашу долбленку.   [А. А. Ливеровский. Журавлиная родина. Рассказы охотника (1966)] [омонимия не снята];NOUN;NPRO
пергаментные лица, в эти острые,;словно;колючие, лопатки, торчащие на сухой, согнутой ;1920;нехудожественная;публицистический;Я вглядываюсь в эти желтые, пергаментные лица, в эти острые, словно колючие, лопатки, торчащие на сухой, согнутой спине, и мне становится и жалко, и грустно…   [А. А. Яблоновский. Египет (1920-1921). Гости английского короля (1920-1921)] [омонимия не снята];ADJ;ADJ
воздуху, последние абрикосы летели вниз,;словно;запоздалая дань, и следом сыпалась мелкая, ;2000;художественная;художественный;Ветви бились и колотили по воздуху, последние абрикосы летели вниз, словно запоздалая дань, и следом сыпалась мелкая, изъеденная гусеницами листва, а дерево сотрясалось уже все, но Велька ничего не видел — он рубил и рубил, разгорячаясь все больше, пока не стал задыхаться. [А. А. Олейников. Велькино детство (2007)] [омонимия не снята];ADVB;ADJ
в теплушке;словно;медведями ходило.  ;1920;художественная;художественный;В теплушке словно медведями ходило.   [А. Г. Малышкин. Падение Даира (1923)] [омонимия не снята];NOUN;NOUN
вспоминает ичас ― было такое чувство,;словно;мы избрали членов рыболовной или тому ;1940;нехудожественная;научный;У меня и моих товарищей ― вновь вспоминает Ичас ― было такое чувство, словно мы избрали членов рыболовной или тому подобной думской комиссіи. [C. П. Мельгунов. Мартовскіе Дни 1917 года (1940-1954)] [омонимия не снята];NOUN;NPRO
рубинов, всю увешанную золотыми побрякушками,;словно;"красавица; за нею водили множество других ";1840;нехудожественная;разговорный;"Между тем привели другую лошадь, белую, с окрашенными по колено розовой краской ногами и в украшениях из невероятной величины рубинов, всю увешанную золотыми побрякушками, словно красавица; за нею водили множество других лошадей. [А. Д. Салтыков. Письма из Индии (1842)] [омонимия не снята]";NOUN;NOUN
руками от командира к рябцу,;словно;предлагал им познакомиться.;1925;художественная;художественный;Он с поклоном повел руками от командира к Рябцу, словно предлагал им познакомиться. [А. А. Фадеев. Разгром (1925-1926)] [омонимия не снята];NOUN;VERB
;словно;эти удивительные существа специально отыскали на ;1990;нехудожественная;публицистический;Словно эти удивительные существа специально отыскали на огромных пространствах континента подземный город, так и оставшийся до наших дней одной из терра инкогнита двадцатого века.   [А. А. Лискин. 50 лет Победы. Лагерь дождевого червя // «Вокруг света», 1995] [омонимия не снята];TRSH;ADJ
ватнике с чужого плеча, внизу;словно;обгрызанном собаками, разодранном на спине, с ;1963;нехудожественная;публицистический;В ватнике с чужого плеча, внизу словно обгрызанном собаками, разодранном на спине, с торчащими белыми клочьями ваты, а кой-где просвечивающим голым посиневшим телом, ― беспризорный, аккомпанируя себе деревянными ложками, пел простуженным голосом:    [M. Д. Ройзман. Из книги «Все, что помню о Есенине» (1963-1970)] [омонимия не снята];ADVB;PRT_GRND
откуда чего и бралось ― макаров;словно;перерождался и нередко со своей вышки ;1883;художественная;художественный;Стоило только суметь поджечь эту натуру, да если к тому же попотчевать рюмочкой, то откуда чего и бралось ― Макаров словно перерождался и нередко со своей вышки рассказывал такие вещи, что все хохотали до слез.   [А. А. Черкасов. Бальджа (1883-1887)] [омонимия не снята];NOUN;VERB
даже в семье;словно;перестали понимать его.;1960;нехудожественная;публицистический;Даже в семье словно перестали понимать его. [А. Азерникова. Со сцены на экран // «Советский экран», 1963] [омонимия не снята];NOUN;VERB
