Left context;Center;Right context;Created;Sphere;Type;Full context;Left_context_POS;Right_context_POS
перенести чертеж на бумагу ― отпечатать,;как;фотоснимок с негатива.;1940;художественная;художественный;Оставалось перенести чертеж на бумагу ― отпечатать, как фотоснимок с негатива. [А. А. Бек. Талант (Жизнь Бережкова) / Части 4-6 (1940-1956)] [омонимия не снята];VERB;NOUN
левитан в приемной вели себя,;как;школьники.;1910;нехудожественная;публицистический;Покуда фотограф возился, приготовляя свои аппараты, Чехов и Левитан в приемной вели себя, как школьники. [M. К. Первухин. Из воспоминаний о Чехове (1915)] [омонимия не снята];NPRO;NOUN
величества интереса, вреде и убытке,;как;скоро о том уведаю, не токмо ;1720;нехудожественная;деловой;"узаконяемые, по крайнему разумению, силе и возможности, предостерегать и оборонять, и в том живота своего, в потребном случае не щадит, и притом, по крайней мере старатися, споспешествовать все, что его царскаго величества верной службе и пользе, во всяких случаях касатися может; о ущербе же его величества интереса, вреде и убытке, как скоро о том уведаю, не токмо благовременно объявлять, но и всякими мерами [[Петр I]. Генеральный регламент (1720)] [омонимия не снята]";NOUN;ADVB
не оставили мы;как;ихъ, такъ и тѣ, кои предками ;1780;нехудожественная;деловой;Не оставили Мы какъ ихъ, такъ и тѣ, кои предками Нашими сооружены были, снабдить надлежащимъ управленіемъ, освободить рукодѣлія, промыслы и торговлю отъ принужденій и притѣсненій, и преподать имъ различные полезные способы и ободренія. [[Екатерина II]. Грамота на права и выгоды городамъ Россійской Имперіи (1785)] [омонимия не снята];NPRO;TRSH
орфографию и законы пунктуации чувствовал,;как;люди чувствуют музыку: « точка- тире ― такого ;1960;нехудожественная;публицистический;Лозинский до тонкости знал орфографию и законы пунктуации чувствовал, как люди чувствуют музыку: « Точка- тире ― такого знака нет по-русски, а у Вас есть», говаривал он, когда держал корректуру моих стихов.   [А. А. Ахматова. Лозинский (1966)] [омонимия не снята];VERB;NOUN
я совершенно не знаю,;как;я написала, уж очень длинное изложение.;1900;нехудожественная;публицистический;Я совершенно не знаю, как я написала, уж очень длинное изложение. [А. А. Аллендорф. Дневник (1900)] [омонимия не снята];VERB;NPRO
не есть течение в искусстве,;как;думают многие.;1920;нехудожественная;деловой;Конструктивизм не есть течение в искусстве, как думают многие. [O. Д. Чичагова. Конструктивизм (1923)] [омонимия не снята];NOUN;VERB
дискуссии о том,;как;учить детей литературе, идут не первый ;2010;нехудожественная;публицистический;Дискуссии о том, как учить детей литературе, идут не первый десяток лет. [А. А. Архангельский, А. А. Данилова. В чем проблемы преподавания литературы в школе?-Александр Архангельский // 2016] [омонимия не снята];ADJ;VERB
что за замечательный писатель толстой,;как;он знает людей! ;1900;нехудожественная;публицистический;Что за замечательный писатель Толстой, как он знает людей!  [А. А. Аллендорф. Дневник (1908)] [омонимия не снята];NOUN;NPRO
узнал, что ничего нет хуже,;как;беспрестанно жить в страхе, и завидовал ;1800;художественная;художественный;"Я узнал, что ничего нет хуже, как беспрестанно жить в страхе, и завидовал собакам, которые меня стращали; однажды, вышедши из терпения, бросился прямо в глаза моим неприятелям, дал себя растерзать на мелкие части, и таким образом оставил в летописях пример зайца ― не труса.   [[Н. М. Карамзин], перевод. Превращения, или история мошки // «Вестник Европы», 1802] [омонимия не снята]";ADJ;ADVB
исходном положении погрузить в воду;как;можно дальше от борта.;1970;нехудожественная;публицистический;Боковое притяжение будет более эффективным, если лопасть в исходном положении погрузить в воду как можно дальше от борта. [B. Повицкий, А. Шалимов. Слаломная техника в путешествиях на надувных лодках (1975)] [омонимия не снята];NOUN;TRSH
на защите;как;лев себя вел, оппоненты на глазах ;1970;художественная;художественный;На защите как лев себя вел, оппоненты на глазах поседели.   [O. М. Куваев. Эй, Бако! (1975)] [омонимия не снята];NOUN;ADJ
очевидно также, что до того,;как;не будет проработан курс электричества, работа ;1920;нехудожественная;публицистический;Очевидно также, что до того, как не будет проработан курс электричества, работа по радио невозможна. [E. Горячкин. Радио в школе // «Радио Всем», 1928] [омонимия не снята];ADJ;AUX
все равно будет при них,;как;вечная драгоценность.;1960;нехудожественная;публицистический;Стихи Пушкина дарили детям русский язык в самом совершенном его великолепии, язык, который они, может быть, никогда больше не услышат и на котором никогда не будут говорить, но который все равно будет при них, как вечная драгоценность. [А. А. Ахматова. Пушкин и дети (1965)] [омонимия не снята];NPRO;ADJ
разруха росли с каждым днем.;как;ни странно, ныне все эти обстоятельства ;1957;нехудожественная;публицистический;разруха росли с каждым днем. Как ни странно, ныне все эти обстоятельства не учитываются.   [А. А. Ахматова. Автобиографическая проза (1957-1965)] [омонимия не снята];ADVB;AUX
в чем же и;как;изменился пушкин?   ;1940;нехудожественная;публицистический;В чем же и как изменился Пушкин?    [А. А. Ахматова. «Каменный гость» Пушкина (1947)] [омонимия не снята];AUX;VERB
не зналъ, на что рѣшиться,;как;вдругъ услышалъ, по направленію къ лѣсу ( ;1850;художественная;художественный;"Меня начала одолѣвать усталость, и я не зналъ, на что рѣшиться, какъ вдругъ услышалъ, по направленію къ лѣсу ( домъ этотъ былъ крайній въ городѣ) пріятные звуки, издаваемые австралійской сорокой; но какъ ни походили они на настоящее пѣніе птицы, все-таки, однако, отзывались подражаніемъ; и я не безъ причины подумалъ, что это какой нибудь сигналъ. [[Роукрофт Ч.]. Разсказы о колоніяхъ Вандименовой земли // «Современникъ», 1850] [омонимия не снята]";VERB;NOUN
состоит исключительно из местных крестьян;как;взрослых, так и подростков обоего пола.;1912;нехудожественная;публицистический;Капелла эта состоит исключительно из местных крестьян как взрослых, так и подростков обоего пола. [А. А. Ахременко. Крестьянская капелла (1912.05.05) // «Московские ведомости», 1912] [омонимия не снята];NOUN;NOUN
наложили мы тут немчуры,;как;дров.;1940;нехудожественная;публицистический;Наложили мы тут немчуры, как дров. [А. А. Авдеев. Дневник (1944)] [омонимия не снята];NOUN;NOUN
людей и разорение домов происходило,;как;от правых, так и ложных доносов, ;1750;нехудожественная;деловой;есть, по которым бесчисленное истязание, гибель людей и разорение домов происходило, как от правых, так и ложных доносов, что сим в пресечении таможен конец свой возмет, ибо тот случай, по которому оное происходило, искореняется. [[Елизавета Петровна]. Указ «Об уничтожении внутренних таможенных и мелочных сборов» (1753)] [омонимия не снята];VERB;AUX
но и лишались имений своих,;как;нерадивые о своем и потомков своих ;1760;нехудожественная;деловой;Правда, что таковые учреждения, хотя и в начале частию казались тягостными и несносными для дворянства, лишаться покоя, отлучаться домов, продолжать против воли своей самим военную и другие службы, и детей своих в оных записывать, от которой некоторые укрывались, подвергая себя за то не только штрафам, но и лишались имений своих, как нерадивые о своем и потомков своих добре.   [[Петр III]. Манифест о даровании вольности и свободы всему российскому дворянству (1762)] [омонимия не снята];ADJ;ADJ
у таланцевых урок прошёл;как;обыкновенно, опять читала боре наставление и ;1900;нехудожественная;публицистический;У Таланцевых урок прошёл как обыкновенно, опять читала Боре наставление и упрекала его в лености, но, в общем, разошлись мы довольно мирно.   [А. А. Аллендорф. Дневник (1905)] [омонимия не снята];VERB;ADVB
это,;как;мы помним, необходимо для того, чтобы ;1920;нехудожественная;публицистический;Это, как мы помним, необходимо для того, чтобы устранить взаимное влияние контуров при перестройках их. [H. Изюмов. Электронная лампа // «Радио Всем», 1928] [омонимия не снята];AUX;NPRO
смотря на то, римский император,;как;глава империи, должен теперь согласиться на ;1800;нехудожественная;публицистический;"Не смотря на то, Римский Император, как глава Империи, должен теперь согласиться на решение Депутации; но ратификация его еще не объявлена. [[Н. М. Карамзин]. Известия и замечания // «Вестник Европы», 1802] [омонимия не снята]";NOUN;NOUN
и подобные породы обычно описывали;как;гранатизированные габбро, гранат-везувиановые фельзиты, гранатиты, офиосфериты ;2000;нехудожественная;научный;В отечественной литературе, однако, термин прижился не сразу, и подобные породы обычно описывали как гранатизированные габбро, гранат-везувиановые фельзиты, гранатиты, офиосфериты и т. д. ( Колман, 1979). Кроме того, часто использовались также названия, отражающие либо особенности химического состава этих горных пород ( известково-силикатные породы, кальциево-алюмосиликатные породы), либо их характерные минеральные ассоциации: хлорит-везувиан-гранатовая порода ( Падалка, 1932), хлорит-гранатовая порода, пироксен-гранатовая порода ( Соболев, 1952). [А. А. Антонов. Минералогия родингитов Баженовского гипербазитового массива (2003)] [омонимия снята];VERB;PRT_GRND
потому что ночью уехал сразу,;как;выпил за рощапкинскую удачу флотские сто ;1970;художественная;художественный;Сейчас он был, наверное, уже в Ленинграде, потому что ночью уехал сразу, как выпил за рощапкинскую удачу флотские сто пятьдесят.   [O. М. Куваев. Эй, Бако! (1975)] [омонимия не снята];ADVB;VERB
подмигнул рощапкину добродушно и мудро,;как;человек, знающий соль бытия.  ;1970;художественная;художественный;А выпив, взял не спеша ломтик лимона и подмигнул Рощапкину добродушно и мудро, как человек, знающий соль бытия.   [O. М. Куваев. Эй, Бако! (1975)] [омонимия не снята];ADVB;NOUN
ту должность, о котором, так;как;и о числе душ, из коего ;1780;нехудожественная;деловой;прикосновенными ему предоставляем на соглашение Наших Генералов- Губернаторов и правящих ту должность, о котором, так как и о числе душ, из коего вся Губерния и в ней уезды составлены будут, подать в Сенат Наш ведомости.   [[Екатерина II]. Указ Именной, данный Сенату 16 сентября 1781 года. Об Учреждении Черниговского Наместничества (1781)] [омонимия не снята];AUX;AUX
крыльев своих в души потомков,;как;семена всего прекрасного, доброго и высокого.;1835;художественная;публицистический;Слава есть любовь настоящего к минувшему, любовь тем чистейшая, что она бескорыстна и справедлива, тем более дивная, что она оживляет своим дыханием пылинки пепла в искры вдохновения и рассыпает их с лучезарных крыльев своих в души потомков, как семена всего прекрасного, доброго и высокого. [А. А. Бестужев-Марлинский. Он был убит (1835-1836)] [омонимия не снята];NOUN;NOUN
и;как;странно въ наши дни представить себѣ, ;1930;нехудожественная;публицистический;И какъ странно въ наши дни представить себѣ, что когда то очень зрѣлые и очень умные люди, смотря на первые автомобили. кривили насмѣшливо губы и солидно предрѣкали этой вздорной новинкѣ, какъ летучей модѣ короткое двухнедѣльное сѵществованіе. [A.И. Купринъ. Бабиль // За рулемъ (Париж), 1933] [омонимия не снята];AUX;ADVB
но свободное употребление оного позволили,;как;то их персиянского закону люди в ;1710;нехудожественная;деловой;И буде мочно снесшися о сем с ним, грузинским царевичем и усмотря удобное время и состояние тамошних дел представить шахову величеству имянем царского величества, чтоб подданным его шахова величества веры христианской благостивой греческого исповедания никакого утеснения и принуждения в своей вере не чинили, но свободное употребление оного позволили, как то их персиянского закону люди в государстве его царского величества всегда имеют, тако ж [[Петр I]. Инструкция Петра I Волынскому для выполнения дипломатической миссии в Персии (1715)] [омонимия не снята];VERB;AUX
было далеко не так оживлённо,;как;два года тому назад.  ;1910;нехудожественная;публицистический;После ужина устроили танцы, но было далеко не так оживлённо, как два года тому назад.   [А. А. Аллендорф. Дневник (1911)] [омонимия не снята];ADVB;NUMR
тогда;как;нынешние материки вытянуты преимущественно с севера ;1920;нехудожественная;публицистический;Тогда как нынешние материки вытянуты преимущественно с севера на юг ( меридионально) ― Америка, Африка, Азия, ― материки полеозойского времени имели вытянутость с запада на восток ( долготную). [А. X-н. История земли. Очерк пятый // «Наука и техника», 1925] [омонимия не снята];ADVB;ADJ
припомнил я теперь,;как;пишу, какое было забавное происшествие, в ;1840;нехудожественная;публицистический;Припомнил я теперь, как пишу, какое было забавное происшествие, в котором я играл важную роль. [А. А. Башилов. Молодость А. А. Башилова (1841) // Заря, 1871] [омонимия не снята];ADVB;VERB
и вѣчно на основаніи законовъ,;как;внутри города, такъ и внѣ онаго.  ;1780;нехудожественная;деловой;"2. Городу подтверждаются правильно принадлежащія по Межевой Инструкціи, или инако законно, земли, сады, поля, пастьбы, луга, рѣки, рыбныя ловли, лѣса, рощи, кустарники, пустыя мѣста, мельницы водяныя или вѣтреныя; всѣ оныя вообще и каждое порознь ненарушимо имѣть, и онымъ пользоваться мирно и вѣчно на основаніи законовъ, какъ внутри города, такъ и внѣ онаго.   [[Екатерина II]. Грамота на права и выгоды городамъ Россійской Имперіи (1785)] [омонимия не снята]";NOUN;AUX
духовные присудствовали: того ради надлежит,;как;при начинании, так и при окончании ;1710;нехудожественная;деловой;И дабы при том все духовные присудствовали: того ради надлежит, как при начинании, так и при окончании службы божия, в трубы у командующаго генерала над войском, знак дать, и потом от полку до полку барабаны бить, или на трубах трубить, и тако службу божию начинать и оканчивать.   [[Петр I]. Артикул воинский (1715)] [омонимия не снята];VERB;AUX
истребит цейланскую жемчужную ловлю, так,;как;она истребилась на берегах персии, южной ;1800;нехудожественная;публицистический;Можно предвидеть, что это небрежение рано или поздно совсем истребит Цейланскую жемчужную ловлю, так, как она истребилась на берегах Персии, южной Америки и Швеции.   [[Н. М. Карамзин]. Ловля жемчужных раковин на острове Цейлане // «Вестник Европы», 1802] [омонимия не снята];AUX;NPRO
или помните, « да;как;же ты венчалась, няня? ;2010;нехудожественная;публицистический;Или помните, « Да как же ты венчалась, няня?  [А. А. Архангельский, А. А. Данилова. В чем проблемы преподавания литературы в школе?-Александр Архангельский // 2016] [омонимия не снята];AUX;AUX
для есенина,;как;и для нас ― его соавторов, было ;1950;нехудожественная;публицистический;Для Есенина, как и для нас ― его соавторов, было важно показать ритм и стремительность этого преображения действительности. [H. A. Павлович. Как создавался киносценарий «Зовущие зори» (1956)] [омонимия не снята];NOUN;AUX
