Left context,Center,Right context,Created,Sphere,Type,Full context,Left_context_POS,Right_context_POS
Аще же приставить себе, аки ,"крылья деревянны, противу естества творит.",1996,художественная,роман,"Аще же приставить себе аки крылья деревянны, противу естества творит. [Андрей Лазарчук, Михаил Успенский. Посмотри в глаза чудовищ (1996)] [омонимия не снята]",NPRO,NOUN
"А выдумку,", аки ,"дьявольскою помощью снаряженную, после божественный литургии ",1996,художественная,роман,"А выдумку, аки дьявольскою помощью снаряженную, после божественный литургии огнем сжечь».   [Андрей Лазарчук, Михаил Успенский. Посмотри в глаза чудовищ (1996)] [омонимия не снята]",NOUN,ADJF
, аки ,"Григорий Богослов” ( до груди, « густа и ",2001,художественная,роман,"аки Григорий Богослов” ( до груди, « густа и широка»);    [Евгений Прошкин. Механика вечности (2001)] [омонимия не снята]",,NOUN
, аки ,"Василий Великий” (« брада до персей подоле», ",2001,художественная,роман,"аки Василий Великий” (« брада до персей подоле», узкая);    [Евгений Прошкин. Механика вечности (2001)] [омонимия не снята]",,NOUN
, аки ,Иоанн ( икий) Великий” (« брада велика и ,2001,художественная,роман,аки Иоанн ( икий) Великий” (« брада велика и широка на концы вдвое   [Евгений Прошкин. Механика вечности (2001)] [омонимия не снята],,NOUN
, аки ,Иоанн ( икий) Великий” (« брада велика и ,2001,художественная,роман,аки Иоанн ( икий) Великий” (« брада велика и широка на концы вдвое   [Евгений Прошкин. Механика вечности (2001)] [омонимия не снята],,NOUN
раскинулась»);, аки ,Филогений” (« на оба плеча раскинулась»);   ,2001,художественная,роман,раскинулась»); аки Филогений” (« на оба плеча раскинулась»);    [Евгений Прошкин. Механика вечности (2001)] [омонимия не снята],VERB,UNKN
Филогений” (« на оба плеча раскинулась»);, аки ,Захарий пророк” (« до пояса длина»);   ,2001,художественная,роман,Филогений” (« на оба плеча раскинулась»); аки Захарий пророк” (« до пояса длина»);    [Евгений Прошкин. Механика вечности (2001)] [омонимия не снята],VERB,NOUN
Захарий пророк” (« до пояса длина»);, аки ,Макарий Римский” ( клином « до полуколена»);   ,2001,художественная,роман,Захарий пророк” (« до пояса длина»); аки Макарий Римский” ( клином « до полуколена»);    [Евгений Прошкин. Механика вечности (2001)] [омонимия не снята],NOUN,NOUN
раскинулась»);, аки ,Филогений” (« на оба плеча раскинулась»);   ,2001,художественная,роман,раскинулась»); аки Филогений” (« на оба плеча раскинулась»);    [Евгений Прошкин. Механика вечности (2001)] [омонимия не снята],VERB,UNKN
Филогений” (« на оба плеча раскинулась»);, аки ,Захарий пророк” (« до пояса длина»);   ,2001,художественная,роман,Филогений” (« на оба плеча раскинулась»); аки Захарий пророк” (« до пояса длина»);    [Евгений Прошкин. Механика вечности (2001)] [омонимия не снята],VERB,NOUN
Захарий пророк” (« до пояса длина»);, аки ,Макарий Римский” ( клином « до полуколена»);   ,2001,художественная,роман,Захарий пророк” (« до пояса длина»); аки Макарий Римский” ( клином « до полуколена»);    [Евгений Прошкин. Механика вечности (2001)] [омонимия не снята],NOUN,NOUN
Макарий Римский” ( клином « до полуколена»)., аки ,"Макарий Египетский” (« по колени долга, а ",2001,художественная,роман,"Макарий Римский” ( клином « до полуколена»). аки Макарий Египетский” (« по колени долга, а от колен два косма повились до земли»).   [Евгений Прошкин. Механика вечности (2001)] [омонимия не снята]",NOUN,NOUN
"снова встают « обои в оружьи,", аки ,"на рать, и мост великий переметаша, ",2009,нехудожественная,повесть,"Так, в 1384 году два вече в разных концах города снова встают « обои в оружьи, аки на рать, и мост великий переметаша, нь ублюде бог и святая Софея от усобныя рати». [Ю. И. Андреева. Многоточие сборки (2009)] [омонимия не снята]",NOUN,PREP
"от оружиа, беша жи мертвии", аки ,на рати».,2009,художественная,повесть,"В 1418 году, во время так любимого историками классовой борьбы бунта Степанки, явление самой богородицы стало последним способом остановить сражение на мосту, где уже шло « губление: овы от стрелы, овы же от оружиа, беша жи мертвии аки на рати». [Ю. И. Андреева. Многоточие сборки (2009)] [омонимия не снята]",NOUN,PREP
"сказал: по чужому наущению действовали,", аки ,паяцы безмозглые в вертепе злоблестящем.,2009,художественная,повесть,"А главное, брате, я уже и так сказал: по чужому наущению действовали, аки паяцы безмозглые в вертепе злоблестящем. [А. В. Жвалевский, Е. Пастернак. Время всегда хорошее (2009)] [омонимия не снята]",VERB,NOUN
"Думал, грех меня,", аки ,"вшу ползучую, раздавит, ан хрен ему! ",2007,нехудожественная,роман,"Думал, грех меня, аки вшу ползучую, раздавит, ан хрен ему!  [Михаил Елизаров. Библиотекарь (2007)] [омонимия не снята]",NPRO,UNKN
"по доброй воле сына: отец, «", аки ,"раба», дрессировал его для карьеры в ",1968-1988,нехудожественная,очерк,"И было оно таковым отнюдь не по доброй воле сына: отец, « аки раба», дрессировал его для карьеры в своей фирме. [С. М. Голицын. Сказания о земле Московской (1968-1988)] [омонимия не снята]",NOUN,NOUN
"Никакой крамолы… Чисты,", аки ,горлицы…  ,1977,художественная,повесть,"Никакой крамолы… Чисты, аки горлицы…   [Чингиз Айтматов. Пегий пес, бегущий краем моря (1977)] [омонимия не снята]",ADJS,UNKN
, Аки ,"тать в нощи, ни с кем ",2000,нехудожественная,роман,"Аки тать в нощи, ни с кем не столкнувшись ни в подъезде, ни в лифте, я благополучно добралась до дверей Никитиной квартиры и вставила ключ в замочную скважину. [Иржи Грошек. Реставрация обеда (2000)] [омонимия не снята]",,NOUN
"Андреева, не ржи,", аки ,кобылица!   ,1972-1979,художественная,рассказ,"Андреева, не ржи, аки кобылица!    [Ю. М. Нагибин. Трое и одна и еще один (1972-1979)] [омонимия не снята]",NOUN,NOUN
т. е. кувалдочку) и прыгнул, аки ,лев на контрабудку.,1972-1979,художественная,рассказ,Я бросил свое “ сало” ( т. е. кувалдочку) и прыгнул аки лев на контрабудку. [Ю. М. Нагибин. Остров любви (1972-1979)] [омонимия не снята],VERB,ADJS
строчку из Библии: « будьте хитры (*), аки ,змии и просты аки голубицы».,2000,художественная,"лекция, цикл",Недавно в интервью одной из газет ты процитировала строчку из Библии: « будьте хитры (*) аки змии и просты аки голубицы». [С. А. Еремеева. Лекции по русскому искусству (2000)] [омонимия не снята],UNKN,NOUN
"бьет- убивается, руками во стены,", аки ,"подраненная- плененная птица- лебедица, колотится, горючими ",1998,художественная,монография,"Тут пуще прежнего разнюнилась красна девица, пациентка наша эксклюзивная: в пол в позахезанный челом бьет- убивается, руками во стены, аки подраненная- плененная птица- лебедица, колотится, горючими слезами умывается:    [Феликс Чуев. Ильюшин (1998)] [омонимия не снята]",NOUN,PRTF
"увидиш, славеноросский народе, дивное твое,", аки ,"от готовой погибели, избавление, врагом твоим ",1999,художественная,роман,"В сем бо едином увидиш, славеноросский народе, дивное твое, аки от готовой погибели, избавление, врагом твоим студное их попрание, славы и державы твоея умножение. [Павел Крусанов. Укус ангела // «Октябрь», 1999] [омонимия не снята]",ADJF,PREP
"похитити роское скипетро, принуждена воспятитися,", аки ,"бы распаленнаго железа коснувшися, а сие ",1999,художественная,роман,"Когда, многократно потщавшися или сломити, или похитити роское скипетро, принуждена воспятитися, аки бы распаленнаго железа коснувшися, а сие то было зависти оной разъярение. [Павел Крусанов. Укус ангела // «Октябрь», 1999] [омонимия не снята]",NOUN,PRCL
Видели есте и еще, аки ,бы до днесь пред очима имате ,1999,художественная,роман,"Видели есте и еще аки бы до днесь пред очима имате вся сия, вельможи, военачальницы и воини российстии!  [Павел Крусанов. Укус ангела // «Октябрь», 1999] [омонимия не снята]",PRCL,PRCL
"и наступил темный сумрак, и", аки ,"оная осяжимая мгла египетская, не на ",1999,художественная,роман,"Всюду смущения н междоусобие, и наступил темный сумрак, и аки оная осяжимая мгла египетская, не на воздусе, но в сердцах человеческих. [Павел Крусанов. Укус ангела // «Октябрь», 1999] [омонимия не снята]",CONJ,ADJF
"предварил нас шедротами своими и,", аки ,"денницу, веселый виктории день возвещающую, предпосла ",1999,нехудожественная,роман,"Однако ж по благоутробию своему подал нам утешение, предварил нас шедротами своими и, аки денницу, веселый виктории день возвещающую, предпосла нам благополучныя утехи: разбит Левенгопт, подстережен пред делом своим изменник, разорен и разсыпан Батурин. [Павел Крусанов. Укус ангела // «Октябрь», 1999] [омонимия не снята]",CONJ,NOUN
"безпечальнаго онаго уже доплывши брега,", аки ,"обратившеся, посматривают на море житейское и ",2012,нехудожественная,комментарий,"Обаче не усумневаюся, яко святии угодницы божии, безпечальнаго онаго уже доплывши брега, аки обратившеся, посматривают на море житейское и нас, братию свою, волнящыхся еще и бедствующих видят, не так своих себе от нас похвал хотят, суще от самаго славы господа прославлении, ― яко тогожде нам блаженства желают, которое они получили, сиесть наследования живота вечнаго. [коллективный. Форум: В жижечке очередная истерия по поводу ЮЮ... Обсуждение (2012)] [омонимия не снята]",NOUN,GRND
"обаче и от краткого воспоминания,", аки ,"от оставленнаго мелкаго следа, можем познати, ",2012,нехудожественная,комментарий,"Но обаче и от краткого воспоминания, аки от оставленнаго мелкаго следа, можем познати, коликий сей муж был, како не всуе нарицался великий князь российский, како разсуждал должность звания своего и не титлу токмо государственную, но и тяжесть государственных дел со усердием носити тщался. [коллективный. Форум: В жижечке очередная истерия по поводу ЮЮ... Обсуждение (2012)] [омонимия не снята]",NOUN,PREP
"междоусобий и несогласий повреждение силы,", аки ,великая скважня.,2012,нехудожественная,комментарий,"Внутрьуду немощна, от внеуду бедна бяше Россия, весьма отчаянному кораблю подобна: от единыя страны насильствие татарское, от другой нападение свейское, яко ветры жестокий, а внутрь отечества от мимошедшых междоусобий и несогласий повреждение силы, аки великая скважня. [коллективный. Форум: В жижечке очередная истерия по поводу ЮЮ... Обсуждение (2012)] [омонимия не снята]",NOUN,ADJF
"того, в котором государских должностей", аки ,зерцало представляется.  ,2012,нехудожественная,комментарий,"Воистинну может всяк по званию своему ходящий государь, и могл Александр наш неложно о себе с Давидом воспевати: « Милость и суд воспою тебе, господи» и прочая словеса псалма того, в котором государских должностей аки зерцало представляется.   [коллективный. Форум: В жижечке очередная истерия по поводу ЮЮ... Обсуждение (2012)] [омонимия не снята]",NOUN,NOUN
, Аки ,"бы другий желает как спастися, а ",2012,нехудожественная,комментарий,"Аки бы другий желает как спастися, а что по званию своему должен, о том ниже помышляя, но и многажды еще званию своему противное творя, ищет пути спасеннаго у сынов погибельных и вопрошает: как спастися?  [коллективный. Форум: В жижечке очередная истерия по поводу ЮЮ... Обсуждение (2012)] [омонимия не снята]",,PRCL
Они суть между живыми, аки ,мертвые.  ,2001,нехудожественная,статья,"Они суть между живыми аки мертвые.   [Георгий Бреев. Применение древних покаянных канонов в таинстве Покаяния с древности и до настоящего времени // «Альфа и Омега», 2001] [омонимия не снята]",NOUN,NOUN
"нежели те, кои без пути,", аки ,"лев рыкаяй, рыщут, иский, кого поглотити.  ",2002,нехудожественная,роман,"а во-вторых, ведь надо же между кем-нибудь казенные доходы делить, так уж пусть лучше получают те, кои дела не делают, а от дела не бегают, нежели те, кои без пути, аки лев рыкаяй, рыщут, иский, кого поглотити.   [Варвара Синицына. Муза и генерал (2002)] [омонимия не снята]",NOUN,ADJS
"богатстве и в пространстве живут,", аки ,"гладким путем ходящии, обаче Бога любяще ",1960-1980,нехудожественная,сказка,"Мнози бо при вере благочести- вой хранящии заповеди Господни, аще и в богатстве и в пространстве живут, аки гладким путем ходящии, обаче Бога любяще и от имений сво- их нищия милующе, тем путем гладким шествуют в небо.   [Виталий Губарев. Преданье старины глубокой (1960-1980)] [омонимия не снята]",VERB,ADJF
"от него же чин владычествующих,", аки ,благая отрасль от благаго корене произыде.,1960-1980,нехудожественная,сказка,"Не от Хама, от негоже рабское племя прозябе, но от Афета, от него же чин владычествующих, аки благая отрасль от благаго корене произыде. [Виталий Губарев. Преданье старины глубокой (1960-1980)] [омонимия не снята]",PRTF,ADJF
"несумненною, благочестивою: вера бо есть", аки ,покрывало вещей невидимых.,1960-1980,нехудожественная,сказка,"Верою во Христа несумненною, благочестивою: вера бо есть аки покрывало вещей невидимых. [Виталий Губарев. Преданье старины глубокой (1960-1980)] [омонимия не снята]",INTJ,NOUN
"пресветло- сияющие, от Владимира святаго,", аки ,"от солнца, немерцающее свое блистание имущие.  ",1960-1980,художественная,сказка,"Мощно бяше тожде рещи и к нашему российскому Аврааму, святому равноапостольному князю Владимиру, от него же равночисленные звездам княжеские домы на российском нашем небе видим пресветло- сияющие, от Владимира святаго, аки от солнца, немерцающее свое блистание имущие.   [Виталий Губарев. Преданье старины глубокой (1960-1980)] [омонимия не снята]",NOUN,PREP
"От сих дванадесяти великих князей,", аки ,"от дванадесяти источник израилевых, коликое множество ",1960-1980,нехудожественная,сказка,"От сих дванадесяти великих князей, аки от дванадесяти источник израилевых, коликое множество благопрорастительных отраслей произыде, кто исчести может?  [Виталий Губарев. Преданье старины глубокой (1960-1980)] [омонимия не снята]",NOUN,PREP
"править не указано, так бояре,", аки ,"псы ощетинясь, рекли, что- де сие ",1997,нехудожественная,статья,"Так вот, когда я отвечал боярам, ― продолжал он, не давая говорить хозяйке, ― что мне того в посольстве править не указано, так бояре, аки псы ощетинясь, рекли, что- де сие великому государю вельми грубо ― не в истерп- де воля новгородская и что- де и великий государь тебе, Василиюпосаднику, указал ответ ево, государев, держать, Великому Новуграду, аркучу тако: « Исправьтесь- де и, отчина моя, Великий Новгород [Рустам Арифджанов. Крещение // «Столица», 1997.12.22] [омонимия не снята]",NOUN,NOUN
молодцы от этой красоты становились «, аки ,"исступленные», перебалованная затем посадником Исачком, за ",1997,нехудожественная,статья,"сказочный « котик ― серебряны лапки», ― потом перебалованная в молодости своею красотой, на которую « ветер дохнуть не смел», а добрые молодцы от этой красоты становились « аки исступленные», перебалованная затем посадником Исачком, за которого она вышла из тщеславия и который « с рук ее не спускал, словно золот перстень», но которым она помыкала, как старою костригою в трепалке; избалованная наконец всем Новгородом, льстившим ее красоте, богатству и [Рустам Арифджанов. Крещение // «Столица», 1997.12.22] [омонимия не снята]",VERB,ADJF
