Left context,Center,Right context,Created,Sphere,Type,Full context,Left_context_POS,Right_context_POS
"мною чернец,  	 И он будет", аки ,верченой жеребец. ,1856,художественная,статья,"Аще содружитца со мною чернец,  	 И он будет аки верченой жеребец.  [Ф. И. Буслаев. Повесть о горе и злочастии, как Горе-Злочастие довело молодца во иноческий чин (1856)] [омонимия не снята]",VERB,ADJF
"зри, та бо красота, сладит", аки ,"медвяная сыта, а после горчае желчи ",1856,нехудожественная,статья,"В поучении Акира: « Пришед в пир, и ты не садись в большем месте, и придут иные, меньше тебя, и они подвинут тебя в большое место, и ты будешь честен; 5 чадо, до дна чары не пей; чадо, на женскую красоту не зри, та бо красота, сладит аки медвяная сыта, а после горчае желчи и полыни травы будет. [Ф. И. Буслаев. Повесть о горе и злочастии, как Горе-Злочастие довело молодца во иноческий чин (1856)] [омонимия не снята]",VERB,ADJF
"Сгинет,", аки ,червь под ногою первого удалого прохожего!..,1834,художественная,роман,"Сгинет, аки червь под ногою первого удалого прохожего!.. [Н. И. Греч. Черная женщина (1834)] [омонимия не снята]",VERB,NOUN
"поднял высоко да простер ее,", аки ,"Устенеян19, царь цареградский; в левой ",1834,нехудожественная,роман,"Бут18 вырезан из камня из черного, вельми велик; хвост у него через него, руку правую поднял высоко да простер ее, аки Устенеян19, царь цареградский; в левой руке у него копье, а на нем нет ничего; видение у него и зад обезьянские. [Н. И. Греч. Черная женщина (1834)] [омонимия не снята]",NPRO,UNKN
"земле, которую поедает поганый бесермен,", аки ,татарская саранча).,1834,художественная,роман,"Мы чествуем и кланяемся сестрице твоей, а нашей господыне, великой княгине Софье Фоминишне за то, что она Русь нашу полюбила паче своей родной земли ( да стоит ли упоминать об этой соромной земле, которую поедает поганый бесермен, аки татарская саранча). [Н. И. Греч. Черная женщина (1834)] [омонимия не снята]",NOUN,ADJF
"Береги это сокровище,", аки ,"зеницу ока; не покидай его никогда, ",1834,нехудожественная,роман,"Береги это сокровище, аки зеницу ока; не покидай его никогда, разве господь попустит ворогу отнять его у тебя. [Н. И. Греч. Черная женщина (1834)] [омонимия не снята]",NOUN,NOUN
"С того денечка нем,", аки ,рыба.,1834,нехудожественная,роман,"С того денечка нем, аки рыба. [Н. И. Греч. Черная женщина (1834)] [омонимия не снята]",ADJS,NOUN
"прежде некогда архимандрита Дубенского, унита,", аки ,"о блуждениях, ересех и самоумышлениих Церкви ",1862-1875,нехудожественная,"очерк, цикл","163 Полное заглавие ее следующее: « Λιθος или камень с пращы истинны Церкве святые, православные российские, на сокрушение ложнопомраченной перспективы или безместного оболгания, от Кассиана Саковича, бывшего прежде некогда архимандрита Дубенского, унита, аки о блуждениях, ересех и самоумышлениих Церкви Русския, в Унии не сущия, тако в составлениих веры, якоже в служении тайн и о инных чинех и законопреданиих обретающихся, лето Божия 1642 в Кракове [Н. И. Костомаров. Русская история в жизнеописаниях ее главнейших деятелей. Выпуск четвертый: XVII столетие (1862-1875)] [омонимия не снята]",NOUN,PREP
"он на дух не переносит,", аки ,Фридрих Ницше и Виктор Буренин ( 1841- ,1864,нехудожественная,очерк,"А Виктор считает литературу служением грозным и услужением гнусным, причем ни одного служителя- услужителя он на дух не переносит, аки Фридрих Ницше и Виктор Буренин ( 1841- 1926) в одном флаконе. [А. И. Левитов. Нравы Московских девственных улиц (1864)] [омонимия не снята]",VERB,NOUN
Кириску он, аки ,Мылгун*.,1880,нехудожественная,роман,Кириску он аки-Мылгун*. [А. Ф. Писемский. Масоны (1880)] [омонимия не снята],NPRO,NOUN
, Аки ,употребляется по отношению к старшему родственнику.  ,1880,нехудожественная,роман,Аки ― употребляется по отношению к старшему родственнику.   [А. Ф. Писемский. Масоны (1880)] [омонимия не снята],,VERB
Ему стало стыдно за, аки ,Мылгуна.,1880,нехудожественная,роман,Ему стало стыдно за аки-Мылгуна. [А. Ф. Писемский. Масоны (1880)] [омонимия не снята],PREP,NOUN
Кириск жалобно заплакал!, Аки ,Мылгун! ,1880,нехудожественная,роман,Кириск жалобно заплакал! Аки-Мылгун!  [А. Ф. Писемский. Масоны (1880)] [омонимия не снята],VERB,NOUN
 Аки- Мылгун!, Аки ,Мылгун! ,1880,художественная,роман,Аки- Мылгун! Аки-Мылгун!  [А. Ф. Писемский. Масоны (1880)] [омонимия не снята],NOUN,NOUN
Кириск жалобно заплакал!, Аки ,Мылгун! ,1880,художественная,роман,Кириск жалобно заплакал! Аки-Мылгун!  [А. Ф. Писемский. Масоны (1880)] [омонимия не снята],VERB,NOUN
 Аки- Мылгун!, Аки ,Мылгун! ,1880,нехудожественная,роман,Аки- Мылгун! Аки-Мылгун!  [А. Ф. Писемский. Масоны (1880)] [омонимия не снята],NOUN,NOUN
"гады, бабулю голодом морим, притесняем,", аки ,"садисты последние, пирожные зажимаем, ведем подсчет ",1857,нехудожественная,рассказ,"Мы же такие гады, бабулю голодом морим, притесняем, аки садисты последние, пирожные зажимаем, ведем подсчет расходов за ней, наверняка вскорости выкинем из квартиры, или стрихнину в суп подсыпем, чтобы не видеть долее её задницу, торчащуюю из холодильника.   [А. Ф. Писемский. Старая барыня (1857)] [омонимия не снята]",VERB,NOUN
"когда сумку открывали, она ревела", аки ,бизон.,1877-1883,художественная,роман,"Зато, когда сумку открывали, она ревела аки бизон. [М. Е. Салтыков-Щедрин. Современная идиллия (1877-1883)] [омонимия не снята]",VERB,NOUN
"тут с версиями и поучениями,", аки ,"барон Порфирио фон Океродастес, который с ",1779,художественная,слово,"А то накинулись тут с версиями и поучениями, аки барон Порфирио фон Океродастес, который с погоняловом Кордуаншпиц, на всех подряд…. [архиепископ Платон (Левшин). Слово на день нерукотвореннаго образа (1779)] [омонимия не снята]",NOUN,NOUN
делает и минет и половой, аки ,"всё же выше ( причём намного, ИМХО), ",1779,нехудожественная,слово,"Но вероятность встретить в одном лице женщину, которая качественно делает и минет и половой аки всё же выше ( причём намного, ИМХО), чем мужчину: -)    [архиепископ Платон (Левшин). Слово на день нерукотвореннаго образа (1779)] [омонимия не снята]",ADJF,ADJF
"Ваня, ― сказал с улыбкой старик, ―", аки ,младенец от крещальной купели.  ,1777,нехудожественная,слово,"Чист ты умом, Ваня, ― сказал с улыбкой старик, ― аки младенец от крещальной купели.   [архиепископ Платон (Левшин). Слово в неделю осмуюнадесять (1777)] [омонимия не снята]",NOUN,NOUN
что они молчат, аки ,рыбы? ,1764,нехудожественная,слово,что они молчат аки рыбы?  [архиепископ Платон (Левшин). Слово в день рождения Его Императорскаго Высочества Благовернаго Государя Цесаревича и Великаго Князя Павла Петровича (1764)] [омонимия не снята],VERB,NOUN
Гордостью обуян, аки ,сатана!   ,1717,нехудожественная,слово,"Гордостью обуян аки сатана!    [архиепископ Феофан (Прокопович). Слово в неделю осмуюнадесять, сказанное в Санктпитербурхе, в церкви Живоначальныя Троицы, во время присутствия Его Царскаго Величества, по долгом странствии возвратившагося, чрез ректора, честнейшаго Отца Прокоповича (1717)] [омонимия не снята]",PRTS,NOUN
"я, на меня же кинутся,", аки ,псы…»   ,1717,художественная,слово,"Упади я, на меня же кинутся, аки псы…»    [архиепископ Феофан (Прокопович). Слово в неделю осмуюнадесять, сказанное в Санктпитербурхе, в церкви Живоначальныя Троицы, во время присутствия Его Царскаго Величества, по долгом странствии возвратившагося, чрез ректора, честнейшаго Отца Прокоповича (1717)] [омонимия не снята]",VERB,UNKN
"колокольнях плавились колокола, « жидкая медь,", аки ,"вода, текла по кровлям церквей».",1717,художественная,слово,"Велик и страшен был тот пожар деревянной Москвы: на колокольнях плавились колокола, « жидкая медь, аки вода, текла по кровлям церквей». [архиепископ Феофан (Прокопович). Слово в неделю осмуюнадесять, сказанное в Санктпитербурхе, в церкви Живоначальныя Троицы, во время присутствия Его Царскаго Величества, по долгом странствии возвратившагося, чрез ректора, честнейшаго Отца Прокоповича (1717)] [омонимия не снята]",NOUN,NOUN
в приказе Большого дворца расцвели, аки ,вертоград кринный и все же… зрю ,1717,художественная,слово,"С тобой мои дела в приказе Большого дворца расцвели аки вертоград кринный и все же… зрю иной раз и вижу тебя схожего со скоморохом, у коего сегодня харя козья, а завтра медвежья… [архиепископ Феофан (Прокопович). Слово в неделю осмуюнадесять, сказанное в Санктпитербурхе, в церкви Живоначальныя Троицы, во время присутствия Его Царскаго Величества, по долгом странствии возвратившагося, чрез ректора, честнейшаго Отца Прокоповича (1717)] [омонимия не снята]",VERB,NOUN
"кальвинщину в домах ваших, сие,", аки ,"короста и парш смрадный, идет на ",1717,художественная,слово,"Властью, данной от бога и великого государя, изметаю я латинщину и кальвинщину в домах ваших, сие, аки короста и парш смрадный, идет на Русь православную!  [архиепископ Феофан (Прокопович). Слово в неделю осмуюнадесять, сказанное в Санктпитербурхе, в церкви Живоначальныя Троицы, во время присутствия Его Царскаго Величества, по долгом странствии возвратившагося, чрез ректора, честнейшаго Отца Прокоповича (1717)] [омонимия не снята]",ADJF,NOUN
"множае гордишися и превозношаешися, рыкаеши,", аки ,"лев, и лукавьствуеши, яко бес, и ",1717,художественная,слово,"Обличая в двенадцатом « Слове» похотливых развратников, Даниил говорит о них: « Ты же обиадаешися, яко скот, и пианствуеши день и нощь, многажды и до блевания, якоже и главою болети и умом пленитися… и паче множае гордишися и превозношаешися, рыкаеши, аки лев, и лукавьствуеши, яко бес, и на диавольская позорища течеши, яко свинопас». [архиепископ Феофан (Прокопович). Слово похвалное о баталии Полтавской (1717)] [омонимия не снята]",VERB,ADJS
"скончася, ты же изнемогше падеся,", аки ,"зверь, неимущи главы».",1717,художественная,слово,"И преиде царская слава твоя и скончася, ты же изнемогше падеся, аки зверь, неимущи главы». [архиепископ Феофан (Прокопович). Слово похвалное о баталии Полтавской (1717)] [омонимия не снята]",GRND,NOUN
"Казань: возвратившись в свои палаты, «", аки ,"ластвица во гнездо свое, с великою ",1717,нехудожественная,слово,"Близко к стилю жития Алексея человека божия передаётся скорбь царицы Анастасии, проводившей своего мужа- царя в поход на Казань: возвратившись в свои палаты, « аки ластвица во гнездо свое, с великою тугою и печалью и со многим сетованием», она « аки светлая звезда темным облаком, скорбию и тоскою прикрывся в полате своей, в ней же живяше, и вся оконца позакры, и света дневного зрети не [архиепископ Феофан (Прокопович). Слово похвалное о баталии Полтавской (1717)] [омонимия не снята]",NOUN,NOUN
"серпом своим и иных множество,", аки ,цретия травнаго или яко листвия смоковнаго; ,1717,нехудожественная,слово,"Эти же образы используются и для развёрнутой метафоры, соединённой с антитезой, как в следующем примере: « Сей есть достоверный Борис, иже прежде подсече благорасцветаемая древа великая, яко кипариси, и пожа немилосердным серпом своим и иных множество, аки цретия травнаго или яко листвия смоковнаго; се ныне где сам обреташеся, яко отнюдь неимущий, повержен на позорищи». [архиепископ Феофан (Прокопович). Слово похвалное о баталии Полтавской (1717)] [омонимия не снята]",NOUN,NOUN
"Мария, « змия лютая злым взором,", аки ,"зверь лютый», по совету злых изменников ",1717,нехудожественная,слово,"Тут кума его Мария, « змия лютая злым взором, аки зверь лютый», по совету злых изменников и советников задумала « злую мысль изменную» ― уловить Скопина, « аки в лесе птицу подобну, аки рысь изжарити». [архиепископ Феофан (Прокопович). Слово похвалное о баталии Полтавской (1717)] [омонимия не снята]",NOUN,NOUN
"Руси до сего дни: « Погибоша,", аки ,обри».  ,1720,нехудожественная,слово,"И есть пословица в Руси до сего дни: « Погибоша, аки обри».   [архиепископ Феофан (Прокопович). Слово похвальное о флоте российском и о победе, галерами российскими над кораблями шведскими иулиа 27 дня полученной (1720)] [омонимия не снята]",NOUN,NOUN
, Аки ,скот безсловесен единою в год к ,1720,художественная,слово,"Аки скот безсловесен единою в год к вешним дням сочетаются с мужи; учиня великое празднество, отправляют и, собравшись по местам, любодеяние творят; и заченши жены во утробе, паки вси разыдутся во своя жилисча. [архиепископ Феофан (Прокопович). Слово похвальное о флоте российском и о победе, галерами российскими над кораблями шведскими иулиа 27 дня полученной (1720)] [омонимия не снята]",,NOUN
"в земли Руской ко благочестию,", аки ,"денница пред солнцем, аки зоря пред ",1720,художественная,слово,"Сия бысть предтекушая в хрестианстве в земли Руской ко благочестию, аки денница пред солнцем, аки зоря пред светом сияющи.   [архиепископ Феофан (Прокопович). Слово похвальное о флоте российском и о победе, галерами российскими над кораблями шведскими иулиа 27 дня полученной (1720)] [омонимия не снята]",NOUN,NOUN
"и до сего дни: « Беда,", аки ,в Родне».,1720,художественная,слово,"Он же, вшед, послал войско осадить Родню и содержал оной в крепкой осаде несколько времени, чрез что учинился в Родне глад велик, от чего есть пословица и до сего дни: « Беда, аки в Родне». [архиепископ Феофан (Прокопович). Слово похвальное о флоте российском и о победе, галерами российскими над кораблями шведскими иулиа 27 дня полученной (1720)] [омонимия не снята]",NOUN,PREP
"своих плакали о том вельми,", аки ,"по мертвых, зане не утвердилися в ",1720,художественная,слово,"Матери же чад своих плакали о том вельми, аки по мертвых, зане не утвердилися в вере и не ведали пользы учения, что тем ум их просвещается и на всякое дело благоугодны творить, и искали безумнии дарами откупаться. [архиепископ Феофан (Прокопович). Слово похвальное о флоте российском и о победе, галерами российскими над кораблями шведскими иулиа 27 дня полученной (1720)] [омонимия не снята]",VERB,PREP
"Анфропоморфиты и нынешние раскольники думают,", аки ,бы образ Божий состоит в нас ,1726,художественная,монография,"Почему не основательно и древние Анфропоморфиты и нынешние раскольники думают, аки бы образ Божий состоит в нас в телесном нашем лице; и по невежеству своему говорят, что когда власы нашего лица остригаются, акиб чрез то погубляется образ Божий. [неизвестный [перевод трактата С. Пуфендорфа]. О должности человека и гражданина по закону естественному. Книга первая (1726)] [омонимия не снята]",VERB,PRCL
"Летописец записал, что рязанцы « падали,", аки ,снопы».  ,1718,художественная,слово,"Летописец записал, что рязанцы « падали, аки снопы».   [архиепископ Феофан (Прокопович). Слово в день Святаго Благовернаго князя Александра Невскаго (1718)] [омонимия не снята]",VERB,NOUN
"плечь спущав, а петли разстегав,", аки ,"роспрели, бяше бо им варно ( жарко), ",1718,нехудожественная,слово,"А ездят, порты своя ( одежду) с плечь спущав, а петли разстегав, аки роспрели, бяше бо им варно ( жарко), бе бо в то время знойно. [архиепископ Феофан (Прокопович). Слово в день Святаго Благовернаго князя Александра Невскаго (1718)] [омонимия не снята]",GRND,NOUN
