Left context,Center,Right context,Created,Sphere,Type,Full context,Left_context_POS,Right_context_POS
"в сем Царствующем Граде возобновить,", аки ,бы все исполняя намерение и желание ,1843,художественная,роман,"Собственным Божии Промыслом, Который Всесилною Своею Властию, яко Премудр Архитектон, восхотел старое и нерегулярное строение отменить, а новое, лучшее и прекраснейшее строение в сем Царствующем Граде возобновить, аки бы все исполняя намерение и желание Петра Великаго, и дабы Град его был прямой Град Петров. [А. Ф. Вельтман. Райна, королева болгарская (1843)] [омонимия не снята]",INFN,PRCL
"прочими старинными государствы и городами,", аки ,бы краинии в том себе недостаток ,1843,художественная,роман,"Но сей Царствующий Новый Град, яко есть некий новорожденный младенец, на сем Земноводном Круге пребывающий, весь есть новый, а древностьми или какими старинными знаками показатся пред прочими старинными государствы и городами, аки бы краинии в том себе недостаток имеющии.   [А. Ф. Вельтман. Райна, королева болгарская (1843)] [омонимия не снята]",NOUN,PRCL
"знатные и достопамятные вещи, которые", аки ,"бы нарочно для его оные родилися, ",1843,художественная,роман,"Того ради по новости сего Царствующаго Града, некоторые не старые, но весма знатные и достопамятные вещи, которые аки бы нарочно для его оные родилися, которые хотя недавные, но весма за древние почтены быть могут следующия.   [А. Ф. Вельтман. Райна, королева болгарская (1843)] [омонимия не снята]",ADJF,PRCL
"когда его обрел, то абие", аки ,"огнь воспалился в сердце его, и ",1843,художественная,роман,"Оной Ботик Петру Великому в сохранение оставил, которой Его Величество сей Ботик, хотя отрок будучи, когда его обрел, то абие аки огнь воспалился в сердце его, и аки острое копие куриозностию прободе ко испытанию его, в тотчас спросить соизволил, что то за судно. [А. Ф. Вельтман. Райна, королева болгарская (1843)] [омонимия не снята]",NOUN,NOUN
"грубым и неполитичным, то есть", аки ,бы все одного состояния какова нибудь ,1843,художественная,роман,"Выше сего объявлено, что весь здешний российской народ, сего Царствующаго Града жители, собраны из разных мест, что хотя древнии историописатели обще российский народ описуют грубым и неполитичным, то есть аки бы все одного состояния какова нибудь были неполитичнаго. [А. Ф. Вельтман. Райна, королева болгарская (1843)] [омонимия не снята]",INTJ,PRCL
"прежде было грубое, неискусное, и", аки ,"бы сумрачное, но ныне всему свету ",1843,художественная,роман,"Но Новый сей Царствующий Град новое себе жителство возымел, то и жителям своим новыя регулы, новыя вежества и искуства, во всем иное и лучшее учредил, так что от прежних времен весма ныне во всем отмененное, прежде было грубое, неискусное, и аки бы сумрачное, но ныне всему свету стало быть приятное, ласковое, и уветливое, так что все приежжающия от всех российских городов всякия люди [А. Ф. Вельтман. Райна, королева болгарская (1843)] [омонимия не снята]",CONJ,PRCL
"всяк очевидно без всякаго сказания,", аки ,"на театре, славу и красоту благолепия ",1843,художественная,роман,"Что сей Град тщанием Ея Величества так ныне красотою своею на высоту славы превзошел, и еще более и более превосходить имать, что всяк очевидно без всякаго сказания, аки на театре, славу и красоту благолепия его зрит; и не толко те, иже в нем жителствуют и красотою славы его наслаждаются, но и те, которые во отдаленных странах пребывающия, слыша о нем, удивляются. [А. Ф. Вельтман. Райна, королева болгарская (1843)] [омонимия не снята]",NOUN,PREP
"младых ногтей действия, имать откуду,", аки ,"трубу вознести, глас свой прославляти тя ",1843,художественная,роман,"Аще бо уже имать Вселенная чесому удивлятися и от презелнаго удивления в восторг восхищатися, егда разсуждает твоя от самых младых ногтей действия, имать откуду, аки трубу вознести, глас свой прославляти тя имать, чего ради в сердцы своем к тебе огнь любви воспаляти, обаче егда еще Град сей, тако премудро устроенный, прекрасно разположенный, предивне украшенный ( 8), во ум восприймет, славы твоея внутрь себе вящше [А. Ф. Вельтман. Райна, королева болгарская (1843)] [омонимия не снята]",NOUN,NOUN
"вся в едином сем Граде,", аки ,"в собрании всех похвал, узрит, и ",1843,художественная,роман,"Егда бо помыслит о всех тех, яже грады прославляют и величиют, вся в едином сем Граде, аки в собрании всех похвал, узрит, и прехвалная, и преславная, и всякую похвалу и славу превосходящая, велие градовом похваление, аще создателя своего преславнейшаго коего воина имут, вящшее егда вожду или князю коему свое восписуют основание. [А. Ф. Вельтман. Райна, королева болгарская (1843)] [омонимия не снята]",NOUN,PREP
"удобоверителне же похваляются, егда начало,", аки ,"род свой, от царя коего производят, ",1843,художественная,роман,"Не удобоверителне же похваляются, егда начало, аки род свой, от царя коего производят, аже древнии стихотворцы, изъявляющии в похвалу градов великих, богов некиих создателей их баснотворне вымыслили ( 9); аки бы показующий, яко еще безсмертнаго по их мнению имут создателя, безсмертной такожде и в безконечной славе имут пребывати, чего ради Града сего кто не прославит?  [А. Ф. Вельтман. Райна, королева болгарская (1843)] [омонимия не снята]",VERB,NOUN
"без разумнаго суровства, всем сберегателям,", аки ,"спящим, и инным разбегшимся, другим избиенным, ",1843,художественная,роман,"Толико же всяких змиев жесточайших, елико разумом почтенных, толико лютейших, елико мняху себе непобедимейших, вся в руках своих содержащих, иже не на колыбель Ираклиеву, но на самыя Царския нападоша Полаты, настоящей везде полунощи страха и забвения, в нощи смущения и без разумнаго суровства, всем сберегателям, аки спящим, и инным разбегшимся, другим избиенным, и инным к бунтовщикам примесившимся, в сицевом страхе и бедствий крыющееся [А. Ф. Вельтман. Райна, королева болгарская (1843)] [омонимия не снята]",NOUN,PRTF
"самая натура изрядно украсила его,", аки ,"красныя лики торжествующия круговодящии обхождением вод, ",1843,художественная,роман,"Красное расположение имать Град сей ( 42), ибо самая натура изрядно украсила его, аки красныя лики торжествующия круговодящии обхождением вод, многия красныя устроила островы, яже Царствующему Граду, Царский разсуждающий Ум приличествующий, царственныя достойно на них основал, утвердил Престол, иже Заступлением Всесилнаго Бога во веки не подвижится, идеже сицевому Граду здатися, самое естество зряшеся требовати. [А. Ф. Вельтман. Райна, королева болгарская (1843)] [омонимия не снята]",NPRO,NOUN
"сицевые взяты многопушечные фрегаты, и", аки ,"от уст лвовых, от превеликаго свейскаго ",1843,художественная,роман,"Где сицевыя, яко вновь в России основавшемся Граде и вновь наченшемся флоте совершахуся торжествам; где сицевыя, когда от торжествующих победителей торжественными враты ведоми бываху плененнии ( 56); где от сицевых малых галер сицевые взяты многопушечные фрегаты, и аки от уст лвовых, от превеликаго свейскаго флота, в чине своем состоящегося, неслыханная сицевая отята победа?  [А. Ф. Вельтман. Райна, королева болгарская (1843)] [омонимия не снята]",CONJ,PREP
"оных градов их же мир,", аки ,матери и инных градов нарицает ( 72).,1843,художественная,роман,"Велия еще и несочтенныя имать почествования восприйми историческия писания, разсмотри в началах оных градов их же мир, аки матери и инных градов нарицает ( 72). [А. Ф. Вельтман. Райна, королева болгарская (1843)] [омонимия не снята]",NOUN,NOUN
"созданному, и сего ради вымыслиша,", аки ,"бы ему на пищали играющу, сами ",1843,художественная,роман,"Во истинну скоро парящего орла Град сей, сицевою скоростию в высоту славы и чести возлетевший, удивляхуся еллинскии мудрецы скорому созданию Града Фивейскаго, от Амфиона созданному, и сего ради вымыслиша, аки бы ему на пищали играющу, сами камения движущияся в стены града обращахуся. [А. Ф. Вельтман. Райна, королева болгарская (1843)] [омонимия не снята]",NOUN,PRCL
"сядет, и будет с тобою,", аки ,бы и в живом естестве сущий…»   ,1895,художественная,роман,"Поколику вся реченная исполниши, желанный тобою придет к тебе, и сядет, и будет с тобою, аки бы и в живом естестве сущий…»    [А. В. Амфитеатров. Жар-цвет (1895)] [омонимия не снята]",NPRO,PRCL
"из-под суда бел и чист,", аки ,снег блистающий.,1845,"нехудожественная, публицистика","дневник, записные книжки","Но милостию божией, доброхотным заступлением престарелой княгини Хилковой, а наипаче через взятку златом, снедью и чем попало, воевода Таракан всякий раз выходил из-под суда бел и чист, аки снег блистающий. [А. В. Дружинин. Дневник (1845)] [омонимия не снята]",ADJS,NOUN
"лезешь, пошто двери чужие ломаешь,", аки ,тать? ,1845,"нехудожественная, публицистика","дневник, записные книжки","Пошто ты, тварь, не в показанное время лезешь, пошто двери чужие ломаешь, аки тать?  [А. В. Дружинин. Дневник (1845)] [омонимия не снята]",VERB,NOUN
"Смерды головы подъемлют,", аки ,змеи…,1845,"нехудожественная, публицистика","дневник, записные книжки","Смерды головы подъемлют, аки змеи… [А. В. Дружинин. Дневник (1845)] [омонимия не снята]",VERB,UNKN
"волноваха заварилась, головы с плеч,", аки ,"кочаны, летят, народ вешают, кровь льется.  ",1845,"нехудожественная, публицистика","дневник, записные книжки","Тамтка сугубая волноваха заварилась, головы с плеч, аки кочаны, летят, народ вешают, кровь льется.   [А. В. Дружинин. Дневник (1845)] [омонимия не снята]",NOUN,NOUN
"в подизбицу, уманив с собой,", аки ,"шаловливый бес, и мягкотелую бабищу Толкачиху, ",1845,"нехудожественная, публицистика","дневник, записные книжки","Затем старец, паки преподав благословение, уходил « еле можаху» к себе в подизбицу, уманив с собой, аки шаловливый бес, и мягкотелую бабищу Толкачиху, главную опекуншу над здоровьем государыни.   [А. В. Дружинин. Дневник (1845)] [омонимия не снята]",NPRO,ADJF
"Многие в раскол,", аки ,"бы в растворенныя двери, побежали, и ",1853,"бытовая, нехудожественная",письмо личное,"Многие в раскол, аки бы в растворенныя двери, побежали, и не исправляя своих заблуждений, во оных утверждаться начали. [И. В. Киреевский. Письма оптинскому старцу Макарию (1853)] [омонимия не снята]",NOUN,PRCL
"самовольно сжигаются, и думают заблужденныя,", аки ,бы они своим самоубийством получат от ,1853,"бытовая, нехудожественная",письмо личное,"И так отсюду родился великий в церкви разврат: многия оными толками прельщенныя оставляют свои домы, детей, сродников; оставя святыя храмы, бегут в леса, кроются в подземных ямах, не имеют Божия церкви, ни пастырей, ни таин, умирают без покаяния и святаго причастия: а иныя, чево не льзя без слез и помянуть, самовольно сжигаются, и думают заблужденныя, аки бы они своим самоубийством получат от Бога [И. В. Киреевский. Письма оптинскому старцу Макарию (1853)] [омонимия не снята]",NOUN,PRCL
"и не думать столь жестоко,", аки ,"бы уже все те погибли, которые ",1853,"бытовая, нехудожественная",письмо личное,"Так надобно же и вам с кротчайшим христианским духом разсуждать о новоисправленных книгах, и не думать столь жестоко, аки бы уже все те погибли, которые по новоисправленным книгам служат, хотя бы усердную к Богу имели веру, и жили непорочно. [И. В. Киреевский. Письма оптинскому старцу Макарию (1853)] [омонимия не снята]",ADVB,PRCL
"понеже вопервых то не истинно,", аки ,бы святая Маккавеев мать сама в ,1853,"бытовая, нехудожественная",письмо личное,"Но сия ваша отговорка к защищению вашему не служит: понеже вопервых то не истинно, аки бы святая Маккавеев мать сама в огнь бросилась. [И. В. Киреевский. Письма оптинскому старцу Макарию (1853)] [омонимия не снята]",ADVB,PRCL
"свет познания твоея истинны, и", аки ,"от сна от прелести востати, и ",1853,"бытовая, нехудожественная",письмо личное,"Благодарим тя, славим и величаем, яко и ныне сему словесному созданию твоему, имярек, возсиял еси в сердце его свет познания твоея истинны, и аки от сна от прелести востати, и к святей твоей апостольской православно- кафолической церкви прибегнути сподобивый. [И. В. Киреевский. Письма оптинскому старцу Макарию (1853)] [омонимия не снята]",CONJ,PREP
"Стоят, проклятые, перед глазами,", аки ,"смерть с косой, и ждут.",1874,художественная,очерк,"Стоят, проклятые, перед глазами, аки смерть с косой, и ждут. [А. И. Левитов. Не к руке (1874)] [омонимия не снята]",NOUN,NOUN
"Ниже да помыслит кто,", аки ,бы намерение наше есть земнаго царя ,1863,художественная,очерк,"Ниже да помыслит кто, аки бы намерение наше есть земнаго царя сравнити небесному. [А. И. Левитов. Московские «комнаты снебилью» (1863)] [омонимия не снята]",NPRO,PRCL
"Тако и они суще книгочии,", аки ,"бы крылатые, покушаются богословствовати, аки бы ",1863,художественная,очерк,"Тако и они суще книгочии, аки бы крылатые, покушаются богословствовати, аки бы летати, да за грубость мозга буесловцами являются, не разумеюще писания, ни силы божия. [А. И. Левитов. Московские «комнаты снебилью» (1863)] [омонимия не снята]",NOUN,PRCL
"сих первее послушаем, да истинна,", аки ,"солнце по прогнании тьмы, яснейшая произыдет.  ",1863,художественная,очерк,"Сим первое дадим место, сих первее послушаем, да истинна, аки солнце по прогнании тьмы, яснейшая произыдет.   [А. И. Левитов. Московские «комнаты снебилью» (1863)] [омонимия не снята]",ADJS,NOUN
27 На тех же, аки ,"перстом показует Павел, учя в посланиях ",1863,художественная,очерк,"27 На тех же аки перстом показует Павел, учя в посланиях своих покорятися властем, яко же послежде увидим.   [А. И. Левитов. Московские «комнаты снебилью» (1863)] [омонимия не снята]",PRCL,NOUN
"законоположений, и от самоизвольных человеческих,", аки ,"бы ко спасению нужных, изобретений, о ",1863,художественная,очерк,"30 Свободил же нас Христос и от обрядовых законоположений, и от самоизвольных человеческих, аки бы ко спасению нужных, изобретений, о чем неоднократно поучает апостол. [А. И. Левитов. Московские «комнаты снебилью» (1863)] [омонимия не снята]",ADJF,PRCL
"таковый обморок и мечтание возимел,", аки ,"бы ему подлинно некто донес, будто ",1863,художественная,очерк,"Той толико болезновал сею страстию и, ненавидя добраго поведения в людех, толь жаждно желал злоключения отечеству своему, что послежде сшел с ума и таковый обморок и мечтание возимел, аки бы ему подлинно некто донес, будто афинеи вси хотят вешатися; тот час же рад и весел вылетел в народ и таковую возгласил проповедь: Мужие, рече, афинейстии!  [А. И. Левитов. Московские «комнаты снебилью» (1863)] [омонимия не снята]",VERB,PRCL
богословское от священнаго писания; не, аки ,бы от писания несразуменного совратилися ( как ,1863,художественная,очерк,"Однако и сии не безоружни являются: мнятся нечто имети богословское от священнаго писания; не аки бы от писания несразуменного совратилися ( как то иным случается), но к своей готовой злобе привлекли не познанное писание. [А. И. Левитов. Московские «комнаты снебилью» (1863)] [омонимия не снята]",PRCL,PRCL
