Left context,Center,Right context,Created,Sphere,Type,Full context,Left_context_POS,Right_context_POS
"и духовных приобретений; також собственно,", аки ,"важнейшия паче иных времен, службы почитать, ",1700-1722,художественная,"проповедь, слово","Також поститися некиих именных дванадесять пятниц, а то для многих телесных и духовных приобретений; також собственно, аки важнейшия паче иных времен, службы почитать, обедню Благовещенскую, утреню Воскресенскую и вечерню Пятьдесятницы. [митрополит Стефан (Яворский). Проповеди (1700-1722)] [омонимия не снята]",ADVB,NOUN
"а простой народ прельщающее, и", аки ,"снежные заметы, правым истины путем идти ",1700-1722,нехудожественная,"проповедь, слово","Но зде не нужда исчислять все неправости: словом рещи, что либо именем суеверия нарещися может, си есть лишнее, ко спасению непотребное, на интерес только свой от лицемеров вымышленное, а простой народ прельщающее, и аки снежные заметы, правым истины путем идти возбраняющее. [митрополит Стефан (Яворский). Проповеди (1700-1722)] [омонимия не снята]",CONJ,ADJF
"нарочно определенные к тому благочинные,", аки ,"бы духовные фискалы, тое все надсматривали ",1700-1722,нехудожественная,"проповедь, слово","Все же тое, чтоб удобнее пошло в дело, указать должен Епископ по всем городам, чтоб закащики, или нарочно определенные к тому благочинные, аки бы духовные фискалы, тое все надсматривали и ему бы Епископу доносили. [митрополит Стефан (Яворский). Проповеди (1700-1722)] [омонимия не снята]",NOUN,PRCL
"чрез слово и тайнодействие пастырей,", аки ,чрез орудие невидимо действующаго.  ,1700-1722,нехудожественная,"проповедь, слово","Дело же внутреннее, еже обращати сердца к покаянию и обновлению жития, есть единаго Бога, благодатию Своею чрез слово и тайнодействие пастырей, аки чрез орудие невидимо действующаго.   [митрополит Стефан (Яворский). Проповеди (1700-1722)] [омонимия не снята]",NOUN,PREP
"И если посмотрим чрез истории,", аки ,"чрез зрительныя трубки, на мимошедшие веки, ",1700-1722,художественная,"проповедь, слово","И если посмотрим чрез истории, аки чрез зрительныя трубки, на мимошедшие веки, увидим все худшее в темных, нежели в светлых учением временах. [митрополит Стефан (Яворский). Проповеди (1700-1722)] [омонимия не снята]",NOUN,PREP
"как отечества, так и церкве,", аки ,корень и семя и основание.,1700-1722,художественная,"проповедь, слово","Убо учение доброе и основательное есть всякой пользы, как отечества, так и церкве, аки корень и семя и основание. [митрополит Стефан (Яворский). Проповеди (1700-1722)] [омонимия не снята]",NOUN,NOUN
"вельми полезно и скоро человека,", аки ,"претворяет в иного, хотя бы прежде ",1700-1722,художественная,"проповедь, слово","Сие вельми полезно и скоро человека, аки претворяет в иного, хотя бы прежде грубых был обычаев.   [митрополит Стефан (Яворский). Проповеди (1700-1722)] [омонимия не снята]",NOUN,VERB
"воспоминая оных именно, на себя", аки ,"бы вину тую приемлет, в первом ",1700-1722,художественная,"проповедь, слово","И так Павел Апостол, обличая учителей, которые, ставя себя высоко, по своему имени ученикам своим нарицатися желали, не воспоминая оных именно, на себя аки бы вину тую приемлет, в первом послании из Коринфом в главе первой, тако ж и на другов своих Петра, Аполлоса. [митрополит Стефан (Яворский). Проповеди (1700-1722)] [омонимия не снята]",NPRO,PRCL
Не да, аки ,"неведомую вещь извещу сия, яже всему ",1797,художественная,статья,"Не да аки неведомую вещь извещу сия, яже всему миру известна и явна суть, но да воспоминающе, аки вторицею терпяще, мимошедшыя победы, множае о наставшем благополучии возрадуемся. [Д. С. Самойлович. Способ самый удобный повсемственного врачевания смертоносной язвы заразоносящейся чумы ко благу всеобщественному предлагает Данило Самойлович (1797)] [омонимия не снята]",PRCL,ADJF
"и уязвитися не могуща, и", аки ,бы от твердой руды составление.,1797,художественная,статья,"Таковое же о себе во народех ощущая мнение, безмерне кичитися и гордитися и народи презирати навыче: единаго себе помышляя быти непобедима, и уязвитися не могуща, и аки бы от твердой руды составление. [Д. С. Самойлович. Способ самый удобный повсемственного врачевания смертоносной язвы заразоносящейся чумы ко благу всеобщественному предлагает Данило Самойлович (1797)] [омонимия не снята]",CONJ,PRCL
"государства противу величествия его суть,", аки ,"реки противо безмернаго окиана, и уже ",1797,нехудожественная,статья,"Аще и всуе презираше крепкий о господе силы российския; не безсилием бо православное сие царство толико разширися, яко вся западный государства противу величествия его суть, аки реки противо безмернаго окиана, и уже прилично о нем рещи оное псаломское слово: « Прострет розги его до моря и даже до рек отрасли его». [Д. С. Самойлович. Способ самый удобный повсемственного врачевания смертоносной язвы заразоносящейся чумы ко благу всеобщественному предлагает Данило Самойлович (1797)] [омонимия не снята]",VERB,NOUN
убо сия сотворися брань нощная;, аки ,"бо в темной нощи, великое бяше ",1797,художественная,статья,"Брань убо сия сотворися брань нощная; аки бо в темной нощи, великое бяше недоумение, кого хранитися, на кого наступати, кого заступати; в едином граде, в едином дому можаху быти двоих противных стран оружия?    [Д. С. Самойлович. Способ самый удобный повсемственного врачевания смертоносной язвы заразоносящейся чумы ко благу всеобщественному предлагает Данило Самойлович (1797)] [омонимия не снята]",ADJF,CONJ
"щита, ни шлема мидянаго, но", аки ,нерушимою стеною и адамантовим забралом огражденно ,1797,нехудожественная,статья,"Не был еси убо одеян в железо, ни обложен твердою бронею, не имел еси ни щита, ни шлема мидянаго, но аки нерушимою стеною и адамантовим забралом огражденно бяше царское лице твое невидимою силою вышняго. [Д. С. Самойлович. Способ самый удобный повсемственного врачевания смертоносной язвы заразоносящейся чумы ко благу всеобщественному предлагает Данило Самойлович (1797)] [омонимия не снята]",CONJ,ADJF
"и народом отъяша, дароваху России:", аки ,бы не иной ради вины пришли ,1797,нехудожественная,статья,"Вся, яже многим градом и народом отъяша, дароваху России: аки бы не иной ради вины пришли к нам, токмо умрети и воинство российское наследники благ своих заветом написати.   [Д. С. Самойлович. Способ самый удобный повсемственного врачевания смертоносной язвы заразоносящейся чумы ко благу всеобщественному предлагает Данило Самойлович (1797)] [омонимия не снята]",NOUN,PRCL
"Видехом поле Полтавское, прейдем прочее,", аки ,"гоняще в след избегших оттуду супостатов, ",1797,художественная,статья,"Видехом поле Полтавское, прейдем прочее, аки гоняще в след избегших оттуду супостатов, и да видим, како и неплодные под Переволочным бреги множество победительнаго вайя в песках своих израстиша. [Д. С. Самойлович. Способ самый удобный повсемственного врачевания смертоносной язвы заразоносящейся чумы ко благу всеобщественному предлагает Данило Самойлович (1797)] [омонимия не снята]",NPRO,ADJS
"поля ратнаго и трепетным бегством,", аки ,"крилами от страха израстшими, скоро устремися ",1797,художественная,статья,"Множае шестнадесяти тисящ оружие носящих супостатских воев избеже з поля ратнаго и трепетным бегством, аки крилами от страха израстшими, скоро устремися ко брегом Днепровым, яко же сами помышляху, спасения ради своего, а яко же вещию показася, не иной ради вины, токмо дабы не единою сотренны были и дабы не едино место и о нашей победе, и о их побеждении засведительствовало. [Д. С. Самойлович. Способ самый удобный повсемственного врачевания смертоносной язвы заразоносящейся чумы ко благу всеобщественному предлагает Данило Самойлович (1797)] [омонимия не снята]",NOUN,NOUN
"мнози речною глубиною пожренны изгибоша,", аки ,"устыдевшемуся Днепру самому зменническаго имене, аще ",1797,художественная,статья,"Ибо, кроме не много дерзским и нуждным плаванием спасшихся, мнози речною глубиною пожренны изгибоша, аки устыдевшемуся Днепру самому зменническаго имене, аще бы послужил ко спасению врагов, иже конечную пагубу на отечество наше навести тщахуся. [Д. С. Самойлович. Способ самый удобный повсемственного врачевания смертоносной язвы заразоносящейся чумы ко благу всеобщественному предлагает Данило Самойлович (1797)] [омонимия не снята]",NOUN,PRTF
"немощны от страха сотворишася и,", аки ,не можаще уже держати в руках ,1797,художественная,статья,"Стояху возбрег Днепра многочисленныя полки свейския и, узревше со ангелом господним поганяющим гонящыя себе российския воя, оскудеша духом и сердцем, безсильны и немощны от страха сотворишася и, аки не можаще уже держати в руках железа военнаго, повергаху на землю оружия своя и, аки ниже просте стояти можаще от трепета, прекланяху победителем колена своя. [Д. С. Самойлович. Способ самый удобный повсемственного врачевания смертоносной язвы заразоносящейся чумы ко благу всеобщественному предлагает Данило Самойлович (1797)] [омонимия не снята]",CONJ,PRCL
"внийдоша силы свейския; погрузишася бо,", аки ,"олово во воде, не возвратися вестник ",1797,художественная,статья,"Услышат ближнии и соседы их и рекут, яко не в землю нашу, но в некое море внийдоша силы свейския; погрузишася бо, аки олово во воде, не возвратися вестник ко отечеству своему. [Д. С. Самойлович. Способ самый удобный повсемственного врачевания смертоносной язвы заразоносящейся чумы ко благу всеобщественному предлагает Данило Самойлович (1797)] [омонимия не снята]",CONJ,NOUN
"Растерзал еси,", аки ,"вторый Самсон ( не без смотрения же, ",1797,нехудожественная,статья,"Растерзал еси, аки вторый Самсон ( не без смотрения же, мню, божия и в день сей Самсона случися победа твоя), растерзал еси мужественне льва свейского. [Д. С. Самойлович. Способ самый удобный повсемственного врачевания смертоносной язвы заразоносящейся чумы ко благу всеобщественному предлагает Данило Самойлович (1797)] [омонимия не снята]",UNKN,ADJF
"не усумневаемся; будет, надеемся тако,", аки ,и получихом.  ,1797,нехудожественная,статья,"Будет то, укрепляющу богу десницу твою, пресветлейший монархо; будет, не усумневаемся; будет, надеемся тако, аки и получихом.   [Д. С. Самойлович. Способ самый удобный повсемственного врачевания смертоносной язвы заразоносящейся чумы ко благу всеобщественному предлагает Данило Самойлович (1797)] [омонимия не снята]",NOUN,CONJ
Недолго страдати ―, аки ,"оком мигнуть, так душа из тела ",1803,нехудожественная,статья,"Недолго страдати ― аки оком мигнуть, так душа из тела выступит… [Д. С. Самойлович. Способ наиудобнейший ко недопущению первоначально возникнуть оказавшейся где-либо промеж народом смертоносной язве, заражаемой чуме (1803)] [омонимия не снята]",NOUN,NOUN
Они же не смутишася!..», Аки ,"отроцы вавилонстии в пещи горящей, тако ",1803,нехудожественная,статья,"Они же не смутишася!..» Аки отроцы вавилонстии в пещи горящей, тако и они в келии зажженной стояли и среди пламени и жупела псалом воспевали: « Изведи из темницы душу мою, ― мене ждут праведницы!..»  [Д. С. Самойлович. Способ наиудобнейший ко недопущению первоначально возникнуть оказавшейся где-либо промеж народом смертоносной язве, заражаемой чуме (1803)] [омонимия не снята]",NOUN,NOUN
"Души же блаженных страстотерпцев,", аки ,"злато в горниле очищенное, ангелы божии ",1803,художественная,статья,"Души же блаженных страстотерпцев, аки злато в горниле очищенное, ангелы божии взяху и в небеса ко Христу царю понесли. [Д. С. Самойлович. Способ наиудобнейший ко недопущению первоначально возникнуть оказавшейся где-либо промеж народом смертоносной язве, заражаемой чуме (1803)] [омонимия не снята]",NOUN,NOUN
"ними же аз пребываю, процветоша", аки ,крины сельные и яко финики и ,1803,художественная,статья,"Поистине, родители мои, здесь царство земное ― покой и тишина, веселие и радость; а святии отцы, с ними же аз пребываю, процветоша аки крины сельные и яко финики и яко кипарисы. [Д. С. Самойлович. Способ наиудобнейший ко недопущению первоначально возникнуть оказавшейся где-либо промеж народом смертоносной язве, заражаемой чуме (1803)] [омонимия не снята]",NOUN,NOUN
"святый брег Светлого Яра качать,", аки ,"младенца в зыбке, твори мысленно молитву ",1803,художественная,статья,"Станет усердного святый брег Светлого Яра качать, аки младенца в зыбке, твори мысленно молитву Исусову и ни словом, ни воздыханием не моги о том ближним поведать… [Д. С. Самойлович. Способ наиудобнейший ко недопущению первоначально возникнуть оказавшейся где-либо промеж народом смертоносной язве, заражаемой чуме (1803)] [омонимия не снята]",INFN,NOUN
Потому что тут погонщики бывают, аки ,звери.,1803,нехудожественная,статья,"Потому что тут погонщики бывают аки звери. [Д. С. Самойлович. Способ наиудобнейший ко недопущению первоначально возникнуть оказавшейся где-либо промеж народом смертоносной язве, заражаемой чуме (1803)] [омонимия не снята]",VERB,NOUN
"Расфуфырена, точно, до страсти,", аки ,барыня какая большая! ,1718,нехудожественная,слово,"Расфуфырена, точно, до страсти, аки барыня какая большая!  [архиепископ Феофан (Прокопович). Слово о власти и чести царской… (1718)] [омонимия не снята]",NOUN,NOUN
а был уж он там., Аки ,лев рыкающий в пустыне Ливийской.,1726,нехудожественная,монография,а был уж он там. Аки лев рыкающий в пустыне Ливийской. [неизвестный [перевод трактата С. Пуфендорфа]. О должности человека и гражданина по закону естественному. Книга вторая (1726)] [омонимия не снята],ADVB,ADJS
"путь этот сложен, морально тернист,", аки ,"в лесу темном грехи таятся, а ",1947-1953,нехудожественная,мемуары,"Я, как узнал, так просто расстроился, вот прямо так и подумал, осознал вдруг ― да, хрен огородный, хоть опять в паломничество по очагам несемейным иди, странствуй, но путь этот сложен, морально тернист, аки в лесу темном грехи таятся, а в кармане почти нет ничего, потому я решил пожарить говядину из Юлькиного холодильника, чтобы поесть и накормить мою блаженную Юльку, что б она делала без [А. А. Игнатьев. Пятьдесят лет в строю. Кн. 1-2 (1947-1953)] [омонимия не снята]",ADJS,PREP
"Есть между ними избранный,", аки ,"Петр, ключарь царствия небесного…",1923,художественная,роман,"Есть между ними избранный, аки Петр, ключарь царствия небесного… [Б. А. Садовской. Карл Вебер (1923)] [омонимия не снята]",ADJF,NOUN
"между царскими слугами есть избранный,", аки ,"Петр, ключарь царствия небесного…",1923,художественная,роман,"Я как теперь слышу: между царскими слугами есть избранный, аки Петр, ключарь царствия небесного… [Б. А. Садовской. Карл Вебер (1923)] [омонимия не снята]",ADJF,NOUN
"комендант был дик и грозен,", аки ,"зверь лютый, а на самом деле ",1927,художественная,роман,"На вид комендант был дик и грозен, аки зверь лютый, а на самом деле вполне приличный человек, к тому же тайно пописывавший стишата: « Моя Нина кругла, как луна, и мягка, как блина…»  [А. П. Чапыгин. Разин Степан (1927)] [омонимия не снята]",ADJS,NOUN
