Left context,Center,Right context,Created,Sphere,Type,Full context,Left_context_POS,Right_context_POS
сравнения в его логической точности: «…, будто ,милостыню сыпал на черные ладони земли» ― ,1980,художественная,повесть,"Сила сравнения в его логической точности: «… будто милостыню сыпал на черные ладони земли» ― у « милостыни», разумеется, « ладони».   [Анатолий Алексин. Сигнальщики и горнисты (1985)] [омонимия не снята]",PNCT,NOUN
"их укутывали, укладывали, как", будто ,это маленький ребенок.,1960,художественная,повесть,"Их укутывали, укладывали, как будто это маленький ребенок. [Г. Г. Демидов. Начальник (1965)] [омонимия не снята]",CONJ,PRCL
почитывал своих греков и как, будто ,не вспоминал злополучную историю.,1970,художественная,рассказ,"Мятлев молчал, отсиживался дома, почитывал своих греков и как будто не вспоминал злополучную историю. [Ю. М. Нагибин. Остров любви (1972-1979)] [омонимия не снята]",CONJ,PRCL
"светлые березнячки, ― но вдруг стемнеет", будто ,и в окно ударит скипидарный хвойный ,1980,художественная,пьеса,"Вокруг пока все то же самое: далекий и ровный, как на море, горизонт да светлые березнячки, ― но вдруг стемнеет будто, и в окно ударит скипидарный хвойный дух, побегут назад пихты, ели, и впервые в жизни ты увидишь кедры. [Л. С. Петрушевская. Три девушки в голубом (1980)] [омонимия не снята]",VERB,CONJ
как, будто ,мы герои какие-то…  ,1970,художественная,рассказ,Как будто мы герои какие-то…   [Виктор Пронин. Оверкиль (1970-1980)] [омонимия не снята],CONJ,NPRO
что-то, будто ,"кольнуло его, и он обернулся в ",2000,художественная,рассказ,"Что-то будто кольнуло его, и он обернулся в сторону Данилова. [Евгений Прошкин. Эвакуация (2002)] [омонимия не снята]",NPRO,VERB
"да еще горстка делает вид,", будто ,догадывается.,1980,художественная,повесть,"Да еще горстка делает вид, будто догадывается. [Виктор Некрасов. Маленькая печальная повесть (1986)] [омонимия не снята]",NOUN,VERB
время как, будто ,"пусто, течение его незаметно, но на ",1970,художественная,повесть,"Время как будто пусто, течение его незаметно, но на самом деле оно хорошо спрятано. [Георгий Полонский, Наталья Долинина. Перевод с английского (1972)] [омонимия не снята]",CONJ,ADVB
а так ―, будто ,"мешает все время, будто торчит что-то, ",1970,художественная,повесть,"А так ― будто мешает все время, будто торчит что-то, не притерпелся еще.   [Октем Эминов. Будь осторожен, Бекназар! (1978)] [омонимия не снята]",CONJ,VERB
"со мной сидел пожилой, как", будто ,"весь сделанный из морщин, и, должно ",1980,художественная,роман,"Рядом со мной сидел пожилой, как будто весь сделанный из морщин, и, должно быть, чахоточный человек. [Еремей Парнов. Третий глаз Шивы (1985)] [омонимия не снята]",CONJ,ADJF
как, будто ,хозяева квартир и работодатели сговорились.,1950,художественная,рассказ,Как будто хозяева квартир и работодатели сговорились. [Борис Можаев. Власть тайги (1954)] [омонимия не снята],CONJ,NOUN
как, будто ,"в ответ на ее тревогу, двери ",1970,художественная,повесть,"Как будто в ответ на ее тревогу, двери разъехались, вошла румяная старушка с бледно-зеленым мальчонкой, и Лена немного успокоилась.   [Валентин Распутин. Прощание с Матёрой (1976)] [омонимия не снята]",CONJ,PREP
"сразу и поразило меня, как", будто ,"огромный колокол ударил в груди, разметая ",1960,художественная,роман,"Понимание пришло сразу и поразило меня, как будто огромный колокол ударил в груди, разметая в клочья никому не нужные внутренности…   [Владимир Брагин. В стране дремучих трав (1962)] [омонимия не снята]",CONJ,ADJF
"как сталь, а вы как", будто ,окись. ,2000,нехудожественная,мемуары,"Мы, как сталь, а вы как будто окись.  [С. Б. Рассадин. Книга прощаний. Воспоминания о друзьях и не только о них (2004-2008)] [омонимия не снята]",CONJ,NOUN
"до того белокожий, что как", будто ,светился.,1980,художественная,рассказ,"Он был до того белокожий, что как будто светился. [Вячеслав Рыбаков. Свое оружие (1987)] [омонимия не снята]",CONJ,VERB
только, будто ,из-за двери снегом кинуло.  ,2000,художественная,мемуары,Только будто из-за двери снегом кинуло.   [В. Д. Алейников. Тадзимас (2002)] [омонимия не снята],PRCL,PREP
"молоденькая сидела потупясь, как", будто ,"разглядывая свои огромные, совсем не по ",1980,художественная,рассказ,"Молоденькая сидела потупясь, как будто разглядывая свои огромные, совсем не по размеру ее маленьких ног, грубые лагерные башмаки.   [Дмитрий Биленкин. Лицо в толпе (1985)] [омонимия не снята]",CONJ,GRND
"зимний: явление деда мороза, как", будто ,поворачивающего ключ ( во времени) и открывающего ,1970,художественная,повесть,"Самый известный из декабрьских дней ― Никола зимний: явление Деда Мороза, как будто поворачивающего ключ ( во времени) и открывающего Новый год.   [Георгий Полонский, Наталья Долинина. Перевод с английского (1972)] [омонимия не снята]",CONJ,PRTF
"жест был такой,", будто ,"он приглашал дорогих гостей к столу, ",2000,художественная,роман,"Жест был такой, будто он приглашал дорогих гостей к столу, уже накрытому, праздничному, истомившемуся, с хрусталем, с тяжелыми блюдами, приминающими крахмальную скатерть. [Дина Рубина. Белая голубка Кордовы (2008-2009)] [омонимия не снята]",ADJF,NPRO
проснулся он как, будто ,от толчка.,1980,художественная,роман,Проснулся он как будто от толчка. [Дина Рубина. На солнечной стороне улицы (1980-2006)] [омонимия не снята],CONJ,PREP
"нашими зелеными холмами, а кажется,", будто ,ветер- лесовал там дорогу ломит.,1980,художественная,пьеса,"Еще не видно ничего за нашими зелеными холмами, а кажется, будто ветер- лесовал там дорогу ломит. [Л. С. Петрушевская. Три девушки в голубом (1980)] [омонимия не снята]",CONJ,NOUN
"осмыслении истории своего края, как", будто ,специально созданного творцом для воплощения многонациональной ,2000,художественная,повесть,"Я надеюсь, что мой роман не только увлечет крымчан своим довольно бурным сюжетом, но также поможет им в осмыслении истории своего края, как будто специально созданного Творцом для воплощения многонациональной гармонии.   [Ю. И. Андреева. Многоточие сборки (2009)] [омонимия не снята]",CONJ,ADVB
"не ела, сидела на лавке,", будто ,"аршин проглочен, и вот иван африканович ",2000,художественная,повесть,"На свадьбе теща не пила, не ела, сидела на лавке, будто аршин проглочен, и вот Иван Африканович все еще помнит эту обиду. [Татьяна Соломатина. Акушер-ХА! Байки (2009)] [омонимия не снята]",NOUN,NOUN
как, будто ,я снова стою в этой ( будь ,1960,художественная,роман,Как будто я снова стою в этой ( будь она неладна!  [Г. Я. Бакланов. Июль 41 года (1964)] [омонимия не снята],CONJ,NPRO
"трос натянулся, напрягся, и плашкоут,", будто ,"почувствовав чью-то твердую руку, стал медленно ",2010,художественная,роман,"Трос натянулся, напрягся, и плашкоут, будто почувствовав чью-то твердую руку, стал медленно разворачиваться носом к берегу, к ветру, к волнам. [Виктор Пелевин. Бэтман Аполло (2013)] [омонимия не снята]",NOUN,GRND
"бойкова, чтобы тот говорил андрею,", будто ,я обязана остаться и помочь с ,2000,художественная,роман,"Все это было очень неприятно, и после спектаклей я несколько раз была вынуждена просить Володьку Бойкова, чтобы тот говорил Андрею, будто я обязана остаться и помочь с декорациями.   [Василий Аксенов. Таинственная страсть (2007)] [омонимия не снята]",NOUN,NPRO
"и дело бегала на кухню,", будто ,"по хозяйству, хотя в этом и ",1970,художественная,рассказ,"Настя то и дело бегала на кухню, будто по хозяйству, хотя в этом и не было никакой нужды, потому что старшая проворная дочь Мокшарихи справлялась с подачей угощений одна.   [Ю. М. Нагибин. Перед твоим престолом (1972-1979)] [омонимия не снята]",NOUN,PREP
"этом сероватом ничто; глупцам кажется,", будто ,"они обретают гармонию, но они лишь ",1950,художественная,"рассказ, цикл","Час и минута одинаково исчезают в этом сероватом ничто; глупцам кажется, будто они обретают гармонию, но они лишь приближают смерть… Граф Дракула, воспоминания и размышления…»    [Евгений Пермяк. Бабушкины кружева (1955-1965)] [омонимия не снята]",CONJ,NPRO
"спокойный, серьезный,", будто ,на работе.,2000,художественная,"очерк, цикл","Спокойный, серьезный, будто на работе. [Евгения Пищикова. Пятиэтажная Россия (2007) // «Русская Жизнь», 2008] [омонимия не снята]",ADJF,PREP
а в саду сидит, будто ,бы ваш внучек алеша и корзиночку ,2000,художественная,рассказ,А в саду сидит будто бы ваш внучек Алеша и корзиночку плетет для ягод… [Азамат Козаев. Двое… Один… (2007)] [омонимия не снята],VERB,PRCL
"она ждёт,", будто ,"знала, что иду, светец воспалила, глядит ",1970,художественная,повесть,"Она ждёт, будто знала, что иду, светец воспалила, глядит исподлобья. [Георгий Полонский. Роль в сказке для взрослых или «Таланты и Полковники» (1970-1980)] [омонимия не снята]",VERB,VERB
"так зыркнул,", будто ,нутро выморозил.,1970,художественная,повесть,"Так зыркнул, будто нутро выморозил. [Георгий Полонский. Роль в сказке для взрослых или «Таланты и Полковники» (1970-1980)] [омонимия не снята]",VERB,NOUN
"можно подумать,", будто ,палачи изъяснялись на языке цветов.  ,2000,художественная,повесть,"Можно подумать, будто палачи изъяснялись на языке цветов.   [Вера Белоусова. По субботам не стреляю (2000)] [омонимия не снята]",INFN,NOUN
"ласковый весельный плеск волнует саню,", будто ,"что-то обещает, что-то нашептывает ей.  ",1970,художественная,повесть,"И этот ласковый весельный плеск волнует Саню, будто что-то обещает, что-то нашептывает ей.   [Геннадий Семар. Снежка ― речка чистая (1977)] [омонимия не снята]",NOUN,NPRO
пошли через толкучку; там как, будто ,стало еще больше народу.,1970,нехудожественная,мемуары,Они снова пошли через толкучку; там как будто стало еще больше народу. [Н. Н. Никулин. Воспоминания о войне (1975)] [омонимия не снята],CONJ,VERB
"кажется,", будто ,слышишь скрип его корзины.,1970,художественная,"повесть, цикл","Кажется, будто слышишь скрип его корзины. [Виктор Астафьев. Царь-рыба (1974)] [омонимия не снята]",CONJ,VERB
"он кулаком с таким негодованием,", будто ,в клетке сидели бен ладен со ,1960,художественная,пьеса,"У, паскуды, ― погрозил он кулаком с таким негодованием, будто в клетке сидели Бен Ладен со своим заместителем.   [Александр Вампилов. Старший сын (1965)] [омонимия не снята]",NOUN,PREP
"сторону майора остро отточенный карандаш,", будто ,"собираясь им, как копьем, пронзить его ",1970,художественная,рассказ,"Хаиткулы направил в сторону майора остро отточенный карандаш, будто собираясь им, как копьем, пронзить его доводы. [Ю. М. Нагибин. Где стол был яств… (1972-1979)] [омонимия не снята]",NOUN,GRND
"сторону снег, лишь слегка прикрывало,", будто ,"для тепла, и он не замерзал.",2000,художественная,повесть,"Зимой здесь ветром сметало в сторону снег, лишь слегка прикрывало, будто для тепла, и он не замерзал. [Татьяна Соломатина. Акушер-ХА! Байки (2009)] [омонимия не снята]",VERB,PREP
"рев тракторов, а ноги как", будто ,шли по вязкому чернозему.,1980,художественная,пьеса,"У Третьякова все еще стоял в ушах рев тракторов, а ноги как будто шли по вязкому чернозему. [Л. С. Петрушевская. Дом и дерево (1986)] [омонимия не снята]",CONJ,VERB
"млечная накипь облаков ― небо сбежало,", будто ,молоко.,1970,художественная,повесть,"Раздувается и дышит порывисто млечная накипь облаков ― небо сбежало, будто молоко. [Валентин Распутин. Живи и помни (1974)] [омонимия не снята]",VERB,NOUN
и как, будто ,ничего особенного.,1980,художественная,роман,И как будто ничего особенного. [Дина Рубина. На солнечной стороне улицы (1980-2006)] [омонимия не снята],CONJ,NPRO
сегодня я не радовалась картинкам!, будто ,я не понимаю! ,1970,художественная,"повесть, цикл",сегодня я не радовалась картинкам! Будто я не понимаю!  [Виктор Астафьев. Царь-рыба (1974)] [омонимия не снята],NOUN,NPRO
"них стук по плитке такой,", будто ,гвозди в мозг забивают.,1980,художественная,роман,"От них стук по плитке такой, будто гвозди в мозг забивают. [Булат Окуджава. Упраздненный театр (1989-1993)] [омонимия не снята]",ADJF,NOUN
"рта торчат зловещие гофрированные шланги,", будто ,высасывающие воздух из бессознательных людей- медуз ,1980,нехудожественная,мемуары,"У иных изо рта торчат зловещие гофрированные шланги, будто высасывающие воздух из бессознательных людей- медуз в металлический ящик на колёсиках. [С. А. Дангулов. Мухина (1981)] [омонимия не снята]",NOUN,PRTF
"тогда ― калитин, ― сказала мать,", будто ,на что-то решившись.  ,2000,художественная,роман,"Тогда ― Калитин, ― сказала мать, будто на что-то решившись.   [А. Е. Рекемчук. Мамонты (2006)] [омонимия не снята]",NOUN,PREP
"рыбалке, чтобы знакомые не подумали,", будто ,"он много зарабатывает и, позавидовав, не ",1950,нехудожественная,биография,"Если опаздывала, говорила, что села не в тот автобус или попалась контролеру; если спрашивали, куда уехал с концертами дедушка, отвечала, что он не на концерте, а на рыбалке, чтобы знакомые не подумали, будто он много зарабатывает и, позавидовав, не сглазили.   [Р. Я. Райт-Ковалева. Роберт Бернс (1959)] [омонимия не снята]",VERB,NPRO
"от лагеря, я пробежала, как", будто ,у меня выросли крылья.,1960,художественная,повесть,"Два километра, которые отделяли город Вольфсберг от лагеря, я пробежала, как будто у меня выросли крылья. [Виктор Драгунский. Сегодня и ежедневно (1964)] [омонимия не снята]",CONJ,PREP
"услышанного, сидящие рядом со мной", будто ,"сжались, напряглись под этим брошенным на ",2010,художественная,роман,"Стало неуютно от всего услышанного, сидящие рядом со мной будто сжались, напряглись под этим брошенным на нас всевидящим оком. [Дина Рубина. Русская канарейка. Блудный сын (2014)] [омонимия не снята]",NPRO,VERB
"испытала неловкое и забавное чувство,", будто ,"она была не со своим, а ",1970,художественная,повесть,"Отдыхая, Настена испытала неловкое и забавное чувство, будто она была не со своим, а с чьим-то чужим мужиком, на которого не имела права. [Октем Эминов. Будь осторожен, Бекназар! (1978)] [омонимия не снята]",NOUN,NPRO
"сужалась кверху, господствуя над столом,", будто ,странная башня.,1960,художественная,роман,"Вино всё ещё стояло на своём месте ― очень высокая коническая бутылка без горлышка как такового: она просто стремительно сужалась кверху, господствуя над столом, будто странная башня. [Владимир Брагин. В стране дремучих трав (1962)] [омонимия не снята]",NOUN,ADJF
"верит прокурору, который сообщил ей,", будто ,сын ее « сознался в своих преступлениях» ,2010,художественная,повесть,"Софья Петровна, приученная верить газетам и официальным лицам более, чем самой себе, верит прокурору, который сообщил ей, будто сын ее « сознался в своих преступлениях» и заслужил приговор « 10 лет дальних лагерей». [Татьяна Соломатина. Мой одесский язык (2011)] [омонимия не снята]",NPRO,NOUN
"пулеметами, и огненные пики трасс", будто ,поддевали остриями распростертые на снегу тела ,2000,художественная,повесть,"А истребители уже неслись над степью, пропарывая воздух крупнокалиберными пулеметами, и огненные пики трасс будто поддевали остриями распростертые на снегу тела людей, переворачивали их в винтообразных белых завертях. [Сергей Шаргунов. Вась-вась (2009)] [омонимия не снята]",NOUN,VERB
