Left context,Center,Right context,Created,Sphere,Type,Full context,Left_context_POS,Right_context_POS
в петербурге жить ―, словно ,спать в гробу» ― это из мандельштама?   ,1960,художественная,роман,В Петербурге жить ― словно спать в гробу» ― это из Мандельштама?    [Л. Р. Кабо. Ровесники Октября (1964-1997)] [омонимия не снята],INFN,INFN
кто-то невидимый, словно ,резинкой стирал черты с плоского лица ,2000,художественная,повесть,Кто-то невидимый словно резинкой стирал черты с плоского лица Агатова. [Грэй Ф. Грин. Кетополис ― Киты и броненосцы (2001)] [омонимия не снята],ADJF,NOUN
"ты говоришь так,", словно ,до этого пожары посещали дом раз ,1950,нехудожественная,повесть,"Ты говоришь так, словно до этого пожары посещали дом раз в квартал, не соглашалась Ольга. [Г. Я. Бакланов. Южнее главного удара (1957)] [омонимия не снята]",CONJ,PREP
"проявлением жизни, или скаты, парящие,", словно ,"орлы ― milobatis aquila, или рыбы- мотыльки, ",2010,художественная,рассказ,"движение беззвучно, где нет криков, охов и стенаний, где нет вообще никакого звука, связанного со всяким наземным проявлением жизни, или скаты, парящие, словно орлы ― Milobatis aquila, или рыбы- мотыльки, ничем не отличающиеся от своих сухопутных братьев ― зеркальное отражение, зазеркальный мир, воспроизводящий почти в точности мир воздушный, только « летать» заменяется на « плавать», со всеми вытекающими отсюда последствиями, фантастическая симметрия, шутка Создателя, исполненная глубокого смысла [Максим Тихомиров. Национальная демография (2014)] [омонимия не снята]",PRTF,NOUN
, словно ,россия в ней и не нуждается.,2000,художественная,отчет,"Словно Россия в ней и не нуждается. [Борис Мурадов. Гран При Европы: вперед в прошлое // «Формула», 2001.08.15] [омонимия не снята]",,NOUN
"ощущение окончательности такое, что она", словно ,осиротела.,2000,нехудожественная,монография,"Ощущение окончательности такое, что она словно осиротела. [Алексей Иванов. Message: Чусовая. Части 6-7 (2007)] [омонимия не снята]",NPRO,ADJS
"увидеть и чудовищную,", словно ,"могила, яму, в которой медленно и ",2000,художественная,роман,"увидеть и чудовищную, словно могила, яму, в которой медленно и неотвратимо скоплялась вода и над которой толстыми паучьими лапами топырились вырванные корни. [Александр Гаррос, Алексей Евдокимов. Новая жизнь. Святочная повесть (2005)] [омонимия не снята]",ADJF,NOUN
что часто вижай представляет собою, словно ,бы две « колеи» с разделяющим их ,1990,художественная,роман,"Драга так его изувечила, что часто Вижай представляет собою словно бы две « колеи» с разделяющим их насыпным островом, заросшим деревьями и кустами. [Иржи Грошек. Легкий завтрак в тени некрополя (1998)] [омонимия не снята]",NPRO,PRCL
"говорит,", словно ,поет.,1980,нехудожественная,повесть,"Говорит, словно поет. [Л. К. Чуковская. Прочерк (1980-1994)] [омонимия не снята]",VERB,VERB
"рванешься,", словно ,"из воды, наверх и поплывешь; поплывешь, ",1970,нехудожественная,повесть,"Рванешься, словно из воды, наверх и поплывешь; поплывешь, но еще не успеешь отплеваться от сенного крошева, забившего рот, ― снова ух на тебя шумный навильник. [Кир Булычев. Девочка с Земли (1971)] [омонимия не снята]",VERB,PREP
"илюша- овощник,", словно ,"рыба, попавшая на берег, глотал воздух ",2000,художественная,повесть,"Илюша- Овощник, словно рыба, попавшая на берег, глотал воздух ртом и рвал с остервенением билеты.   [Андрей Геласимов. Разгуляевка (2008)] [омонимия не снята]",NOUN,NOUN
"нет уж, к чертям, ― ноги,", словно ,"спицы спортивного велосипеда, в своем мелькании ",1960,нехудожественная,повесть,"Нет уж, к чертям, ― ноги, словно спицы спортивного велосипеда, в своем мелькании исчезли совсем, и тело, как бы приподнятое над землей, летело само по себе, ее не касаясь.   [Г. Я. Бакланов. Мертвые сраму не имут (1961)] [омонимия не снята]",NOUN,NOUN
а она, словно ,ничего не боится.,2000,художественная,интервью,"А она словно ничего не боится. [Александр Клейн. Пауло Коэльо: Выбор всегда за мной // «Пятое измерение», 2002] [омонимия не снята]",NPRO,NPRO
не подходило одно к другому., словно ,плохо составленный фоторобот.,2010,художественная,рассказ,не подходило одно к другому. Словно плохо составленный фоторобот. [Максим Тихомиров. Национальная демография (2014)] [омонимия не снята],ADJF,PRED
и он, словно ,"бы не замечал, как приходил к ",2010,художественная,роман,"И он словно бы не замечал, как приходил к безвыходному противоречию: логически получалось так, что все исходило от этой абсолютной силы, и свобода воли превращалась в бессмыслицу. [Наталья Александрова. Последний ученик да Винчи (2010)] [омонимия не снята]",NPRO,PRCL
"нерон долго осматривал тело убитой,", словно ,"не веря своим глазам, и, наконец, ",1980,художественная,роман,"Нерон долго осматривал тело убитой, словно не веря своим глазам, и, наконец, пробурчал, поднимаясь от трупа: « Я и не знал, что у меня такая красивая мать». [Владимир Дудинцев. Белые одежды / Первая часть (1987)] [омонимия не снята]",ADJF,PRCL
голос незнакомца проник ко мне, словно ,из космической дали.,1960,художественная,повесть,Голос незнакомца проник ко мне словно из космической дали. [Николай Дубов. Небо с овчинку (1966)] [омонимия не снята],NPRO,PREP
"собственной немощи, а вспорхнула и", словно ,"бы поплыла над грязной, дурно пахнущей ",1970,нехудожественная,роман,"Вот уже и тело делается легким и послушным, как прежде,― не поднялась с трудом, напрягая каждый мускул и пересиливая боль и страх и отвращение к собственной немощи, а вспорхнула и словно бы поплыла над грязной, дурно пахнущей постелью, над судном, наполненным отходами моей жизнедеятельности― единственный зримый и обоняемый признак того, что я существую, над пылью, паутиной, тараканами, над тем, что некогда было домом [Н. Н. Берберова. Железная женщина (1978-1980)] [омонимия не снята]",CONJ,PRCL
"коридору, поворачивает налево и вдруг", словно ,проваливается вниз.  ,2010,художественная,роман,"Тетя Паша делает несколько шагов по коридору, поворачивает налево и вдруг словно проваливается вниз.   [Алексей Иванов. Комьюнити (2012)] [омонимия не снята]",ADVB,VERB
"осознала, кого она потеряла и", словно ,"воскликнула ― « ах, почему я не заметила ",2000,художественная,статья,"И лишь некоторое время спустя Вена осознала, кого она потеряла и словно воскликнула ― « Ах, почему я не заметила этого вовремя!?»  [Дмитрий Иванов. Жил-был бобр // «Вокруг света», 2004.06.15] [омонимия не снята]",CONJ,VERB
"подойти к воротам мандира, как ―", словно ,по заказу ― вдруг зазвучала негромко приятная ,2000,нехудожественная,статья,"Стоило мне только подойти к воротам мандира, как ― словно по заказу ― вдруг зазвучала негромко приятная индийская музыка и, через несколько минут, я увидел в метрах 50 от себя небольшую процессию, которую возглавлял небольшого роста старичок с пышной копной волос на голове в ярко-оранжевом одеянии. [Леонид Беррес. Путин в органах // «Известия», 2003.01.04] [омонимия не снята]",CONJ,PREP
"археолог,", словно ,"нехотя, рассказал нам, что недавно стали ",1990,художественная,рассказ,"Археолог, словно нехотя, рассказал нам, что недавно стали копать тут яму для телефонного столба. [Мария Голованивская. Буря (1990-2000)] [омонимия не снята]",NOUN,ADVB
"бы исподволь, она существует подспудно,", словно ,"постоянно звучащая в ушах мелодия, словно ",2000,нехудожественная,статья,"Душевная драма Пилата в спектакле Люпы раскрывается как бы исподволь, она существует подспудно, словно постоянно звучащая в ушах мелодия, словно химический элемент, разлитый в теле. [Забыть о дефолте // «Криминальная хроника», 2003.06.24] [омонимия не снята]",ADVB,ADVB
полюбил одно стихотворение ― « и тогда, словно ,"калиточка отворилась, ― объяснил он.",1970,художественная,очерк,"Он ответил, что сначала не воспринимал совсем, но потом воспринял и полюбил одно стихотворение ― « и тогда словно калиточка отворилась, ― объяснил он. [Л. К. Чуковская. Процесс исключения (Очерк литературных нравов) (1978-1989)] [омонимия не снята]",ADVB,NOUN
"легких платьев шум,  	 я мести,", словно ,"милости прошу,  	 и ненависти жду, как ",1970,художественная,повесть,"Когда ты исчезаешь зыбкой тенью,  	 Когда стихает легких платьев шум,  	 Я мести, словно милости прошу,  	 И ненависти жду, как снисхожденья.    [С. М. Голицын. Тайна старого Радуля (1972)] [омонимия не снята]",NOUN,NOUN
вышел на дорогу ― промзона, словно ,вымерла.,1950,художественная,повесть,Вышел на дорогу ― промзона словно вымерла. [Г. Я. Бакланов. Южнее главного удара (1957)] [омонимия не снята],NOUN,VERB
"читать молитву, провела по лицу,", словно ,умывалась.  ,2000,художественная,статья,"Сайера- апа, закончив читать молитву, провела по лицу, словно умывалась.   [Сергей Козлов. Волшебники-недоучки // «Боевое искусство планеты», 2004.03.11] [омонимия не снята]",NOUN,VERB
"то ли усыпляет, гипнотизируя ритмом,", словно ,в колыбели.,2000,художественная,роман,"Ветка то ли крестит дорогу раскольничьим двоеперстием, то ли усыпляет, гипнотизируя ритмом, словно в колыбели. [Чингиз Абдуллаев. Мистерия эпохи заката (2007)] [омонимия не снята]",NOUN,PREP
"уж, случалось, слыхали), ― как они,", словно ,"муравьи, изо дня в день ― а ",2000,художественная,роман,"Пока Витек таким образом курировал молодежные стройки, Марья Гавриловна ходила купаться на речку Жабрю и с интересом наблюдала, как несколько полуголых амбалов и с ними доходяга с запавшим подреберьем, а лицом неистовым и обжигающим, как у Леши Златашова в чумовом одном соло ( да уж, случалось, слыхали), ― как они, словно муравьи, изо дня в день ― а май стоял небывало знойный ― стучали и пилили и [Сергей Есин. Маркиз Астольф де Кюстин. Почта духов, или Россия в 2007 году. Переложение на отечественный Сергея Есина (2008)] [омонимия не снята]",NPRO,NOUN
"говном польёт… ходит и ходит,", словно ,стыд позабыл.,1970,нехудожественная,повесть,"В один двор зайдёт, душу травит, в другой зайдёт, как говном польёт… Ходит и ходит, словно стыд позабыл. [Владислав Крапивин. Болтик (1976)] [омонимия не снята]",VERB,NOUN
"расхаживал он по нашей квартире,", словно ,"примеряясь, куда бы ударить.",1950,нехудожественная,повесть,"то слабо не будет», ― расхаживал он по нашей квартире, словно примеряясь, куда бы ударить. [Г. Я. Бакланов. Южнее главного удара (1957)] [омонимия не снята]",NOUN,GRND
"верхушки сопок заблестели под луной,", словно ,серебряные.,1950,нехудожественная,сказка,"В четыре часа наступила ночь, и верхушки сопок заблестели под луной, словно серебряные. [Николай Носов. Незнайка в Солнечном городе (1958)] [омонимия не снята]",NOUN,ADJF
"взлелеяли, но зотова не трогали,", словно ,"чувствовали, что он чересчур любит свою ",2000,нехудожественная,монография,"Непьющий, могучего телосложения, к тому же плохо видящий ― другого такого женщины давно бы укротили, женили и вообще взлелеяли, но Зотова не трогали, словно чувствовали, что он чересчур любит свою физику.   [Алексей Иванов. Message: Чусовая. Части 6-7 (2007)] [омонимия не снята]",VERB,VERB
"все приноравливались, относились к ним,", словно ,к данности: ну и что с ,2000,нехудожественная,рассказ,"К ним быстро все приноравливались, относились к ним, словно к данности: ну и что с того, что они, каковы уж есть, ― неизменны, что они, такие, родимые, то есть явь, да и все, ― неизбежны?    [Александр Силаев. Подлое сердце родины (2007)] [омонимия не снята]",NPRO,PREP
"она даже слегка наклоняется вперед,", словно ,"пытаясь услышать, неужели и дядя володя, ",1990,художественная,роман,"Она даже слегка наклоняется вперед, словно пытаясь услышать, неужели и дядя Володя, почти родственник, шесть лет проживший рядом с нашей квартирой, ответит согласием на это предательское предложение.   [Олег Дивов. Выбраковка (1999)] [омонимия не снята]",ADVB,GRND
"а теперь на целую жизнь,", словно ,я ничего не жил с тех ,1960,художественная,роман,"Тогда меня отбросило на пятнадцать лет, а теперь на целую жизнь, словно я ничего не жил с тех пор, как, замкнутый в одном из помещений великой семьи, ждал и не ждал, надеялся и не надеялся, был и не был — был или не был, — и гамлетовский вопрос опрокинулся в прошлое: был или не был?  [Н. Н. Берберова. Курсив мой (1960-1966)] [омонимия не снята]",NOUN,NPRO
"тяжелых сапог, не быстрый, размеренный,", словно ,"его преследователь знал, что спешить ему ",1990,художественная,повесть,"А Артем бежал, не оборачиваясь, слыша за собой мерный топот тяжелых сапог, не быстрый, размеренный, словно его преследователь знал, что спешить ему некуда, что все равно Артем ему попадется, рано или поздно… И вот, наконец, Артем подбегает к костру, и видит что спиной к нему сидит у костра человек, и он тормошит сидящего, и просит помочь… Но сидящий вдруг падает навзничь, и видно [Михаил Гиголашвили. Экобаба и дикарь (1998-2007) // «Зарубежные записки», 2009] [омонимия не снята]",ADJF,NPRO
"перил скручены с такой силой,", словно ,здесь резвился годзилла.,2000,нехудожественная,роман,"Металлические прутья перил скручены с такой силой, словно здесь резвился Годзилла. [Дмитрий Быков. Орфография (2002)] [омонимия не снята]",ADVB,ADVB
"крутишь в голове предложение,", словно ,"читаешь его в книге, а потом ",1970,художественная,повесть,"Крутишь в голове предложение, словно читаешь его в книге, а потом вдруг понимаешь, что мысли начали путаться, и ты повторяешь какое-то слово, повторяешь, повторяешь, а предложение рассыпается и ускользает от тебя. [Георгий Полонский. Ключ без права передачи (1975)] [омонимия не снята]",NOUN,VERB
"про « на год старше» так,", словно ,это было со стороны али то ,1960,художественная,повесть,"здесь живет эта Аля, на год меня старше, ― продолжала она, произнося слова про « на год старше» так, словно это было со стороны Али то ли очевидным недостатком, то ли неоправданным вызовом. [Василий Аксенов. Коллеги (1962)] [омонимия не снята]",CONJ,PRCL
"об актерском мастерстве, то вскользь,", словно ,"боясь потонуть в дебрях терминов, в « ",1980,художественная,роман,"А если и говорили об актерском мастерстве, то вскользь, словно боясь потонуть в дебрях терминов, в « трясине» подсознания и интуиции.   [Фазиль Искандер. Сандро из Чегема (Книга 2) (1989)] [омонимия не снята]",ADVB,GRND
"теперь я чувствовал, что меня", словно ,подменили.,2000,нехудожественная,статья,"А теперь я чувствовал, что меня словно подменили. [Александр Сапелин. Бомарцо // «Ландшафтный дизайн», 2003.03.15] [омонимия не снята]",NPRO,VERB
"костлявое лицо, скошенное кислой гримасой,", словно ,во рту он держал ломтик лимона.,2000,нехудожественная,статья,"У него было костлявое лицо, скошенное кислой гримасой, словно во рту он держал ломтик лимона. [О двух событиях прошедшего концертного сезона // «Российская музыкальная газета», 2003.06.11] [омонимия не снята]",NOUN,PREP
"и везде слышалось зеленое движение,", словно ,сама весна в последний раз мела ,2000,нехудожественная,статья,"Солнце дробилось в реке на ветряной голубой зыби, трава за день заметно выросла, и везде слышалось зеленое движение, словно сама весна в последний раз мела по земле зеленым подолом.   [Александр Чечуров. Страна-питомник в центре Европы // «Ландшафтный дизайн», 2001.11.15] [омонимия не снята]",NOUN,ADJF
