Left context,Center,Right context,Created,Sphere,Type,Full context,Left_context_POS,Right_context_POS
"и смешать, заправить сметанным соусом", а-ля ,"цезарь  ( сметану посолить, добавить чеснок давленный ",2000,нехудожественная,мемуары,"Всё порезать и смешать, заправить сметанным соусом а-ля Цезарь  ( сметану посолить, добавить чеснок давленный и специи по вкусу  ( я использую приправу для овощных салатов готовую в пакетике). [Александр Городницкий. «И жить еще надежде» (2001)] [омонимия не снята]",NOUN,NOUN
нас и их заменить меховиною «, а-ля ,"козел», то стало ясно: переплетчиков ― это, ",2000,нехудожественная,статья,"Когда открылось, что задание Переплетчикова ― снять штаны с нас и их заменить меховиною « а-ля козел», то стало ясно: Переплетчиков ― это, это: того!  [Любовь Стоцкая. Как одеться от «Эр Франс» // «Бизнес-журнал», 2004.01.22] [омонимия не снята]",NOUN,NOUN
"размашистой кистью, за один прием,", а-ля ,"прима, нарисованными, с маху, с вырвавшимся ",1920,нехудожественная,мемуары,"по акварельной, китайской желтизне кожуры даже усеянными, будто бы чьей-то веселой, размашистой кистью, за один прием, а-ля прима, нарисованными, с маху, с вырвавшимся из-под контроля разума, детским отчаянным озорством, ― эх, была не была!  [В. А. Гиляровский. Москва и москвичи (1926-1934)] [омонимия не снята]",NOUN,NOUN
он носил не щегольскую бородку, а-ля ,"ван дейк, а простую, как носят ",1920,художественная,роман,"В отличие от саудовских аристократов он носил не щегольскую бородку а-ля ван Дейк, а простую, как носят муллы. [И. С. Шмелев. Солнце мертвых (1923)] [омонимия не снята]",NOUN,PRCL
они приобрели налет изысканной модерновой  «, а-ля ,"рюскости», все чем-то напоминали избушку на ",1900,художественная,рассказ,"Все они приобрели налет изысканной модерновой  « а-ля-рюскости», все чем-то напоминали избушку на курьих ножках, построенную той же командой в Абрамцеве для « девочки с персиками», Верочки Мамонтовой.   [Скиталец (С. Г. Петров). Октава (1900)] [омонимия не снята]",ADJF,VERB
"питания, их новое изобретение ― пирожки «", а-ля ,гамбургер» позволит любителям « бургеров» забыть о ,2010,нехудожественная,форум,"По заявлению представителей компании « Гарденбургер», лидера американской индустрии здорового питания, их новое изобретение ― пирожки « а-ля гамбургер» позволит любителям « бургеров» забыть о диетах и наслаждаться знакомым запахом и вкусом без опасения набрать вес или превысить норму холестерина в крови. [коллективный. Форум: Я за гей-парад (2011)] [омонимия не снята]",NOUN,NOUN
такая эспаньолка у него ―, а-ля ,"наполеон третий, или кто там еще… ",1930,художественная,роман,"Такая эспаньолка у него ― а-ля Наполеон Третий, или кто там еще… забыла. [Ю. Н. Тынянов. Пушкин (1935-1943)] [омонимия не снята]",NPRO,NOUN
в одном простенке туалетный столик, а-ля ,помпадур с серебряным вызолоченным лавабо и ,1870,художественная,пьеса,"В одном простенке туалетный столик а-ля помпадур с серебряным вызолоченным лавабо и со всеми своими прихотливыми затеями; в другом ― довольно большой стол; на нем, в ящике за стеклом, коллекция золотых табакерок: круглых, овальных, четырехугольных, высоких, плоских, сундучками, брусочками, лодочками, с эмалью, резьбою, антиками и портретами. [А. Н. Островский. Последняя жертва (1877)] [омонимия не снята]",NOUN,NOUN
"в режиме онлайн сообщения перехватывает,", а-ля ,сниффера.,1960,художественная,повесть,"Там не в хистори дело- то, там в проге, которая в режиме онлайн сообщения перехватывает, а-ля сниффера. [Михаил Анчаров. Золотой дождь (1965)] [омонимия не снята]",VERB,NOUN
телах можно писать только юморески, а-ля ,петросян.,2000,нехудожественная,мемуары,О наших мелких душонках в занюханых безобразных телах можно писать только юморески а-ля Петросян. [Татьяна Шмыга. Счастье мне улыбалось... (2000)] [омонимия не снята],NOUN,NOUN
собственный эксклюзивный вариант хвойного растения, а-ля ,садовый « бонсай».  ,2000,нехудожественная,статья,"В результате получите собственный эксклюзивный вариант хвойного растения а-ля садовый « бонсай».   [Александр Сапелин. Искусство медленно жить // «Ландшафтный дизайн», 2002.05.15] [омонимия не снята]",NOUN,ADJF
"на постамент и принимали позы """, а-ля ,"себя творцы истории"".",2000,нехудожественная,интервью,"Конгресс начался в Юсуповском дворце, а затем переместился на Манежную площадь, где прошла акция "" Я― памятник себе…"" ― писатели бодро взгромождались на постамент и принимали позы "" а-ля себя творцы истории"". [Юлия Кантор. Борис Стругацкий: «Хочется жить, если ты молод, здоров и не подлежишь призыву в армию» // «Известия», 2002.09.27] [омонимия снята]",NOUN,NPRO
она действительно того… какая-нибудь эдакая…, а-ля ,патти!..,1900,художественная,рассказ,"Хотя в нашу Мухрованщину едва ли занесет что-нибудь путное… а впрочем, чем черт не шутит… Может быть, она действительно того… какая-нибудь эдакая… а-ля Патти!.. [А. И. Куприн. С улицы (1904)] [омонимия не снята]",UNKN,NOUN
"всем комнатам маскированные, у столов ―", а-ля ,"фуршет, хватай, на что глаза глядят, ― ",2000,нехудожественная,обзор,"Гремела музыка, крутились танцующие пары, сновали по всем комнатам маскированные, у столов ― а-ля фуршет, хватай, на что глаза глядят, ― всем весело, всем не до сна, а Кэтти спит, не улыбнется.   [Х. Ботаник. Байда: Музыка // «Хулиган», 2004.06.15] [омонимия не снята]",NOUN,NOUN
"меня ручной, бухарский, поставила керамику", а-ля ,гидрия и тип-топ!   ,2000,нехудожественная,статья,"Я постелила на нее коврик, знаешь, у меня ручной, бухарский, поставила керамику а-ля гидрия и тип-топ!    [Борис Николашин. Возделывая свой сад // «Биржа плюс свой дом» (Н. Новгород), 2002.08.12] [омонимия не снята]",NOUN,NOUN
"в джинсовом костюме, в сапогах «", а-ля ,"мушкетер боярский», явилась паша в родные ",1860,художественная,"очерк, цикл","Перекрашенная в золотой цвет, с шапкой завитых, да и не завитых, а прямо-таки взвихренных волос, с засиненными веками, в джинсовом костюме, в сапогах « а-ля мушкетер Боярский», явилась Паша в родные края, бурная, все сокрушающая, с цигаркой в зубах.   [М. Е. Салтыков-Щедрин. Помпадуры и помпадурши (1863-1874)] [омонимия не снята]",NOUN,NOUN
благоуханиях пармской фиалки и буке-, а-ля ,"марешаль, эта отечественная непристойность напоминала запах ",1990,художественная,повесть,"И в самом деле, здесь, в замороженном приличии большого света, в благоуханиях пармской фиалки и буке- а-ля-марешаль, эта отечественная непристойность напоминала запах рыбного садка у Пантелеймонского моста или гнилой капусты из погребов Пустого рынка.   [Вячеслав Рыбаков. Трудно стать Богом (1996)] [омонимия не снята]",NOUN,NOUN
носил усики, а-ля ,"адольф менжу, был так же изящен ",2000,нехудожественная,форум,"Носил усики а-ля Адольф Менжу, был так же изящен и ― как только открыл рот ― оказался действительно французом. [Женщина + мужчина: Секс (форум) (2004)] [омонимия не снята]",NOUN,NOUN
на мировой рынок с очередным «, а-ля ,значит брести в толпе.,1960,нехудожественная,"предисловие, послесловие",Но выходить на мировой рынок с очередным « а-ля» ― значит брести в толпе. [Р. М. Беньяш. В гриме и без грима (1965)] [омонимия не снята],ADJF,CONJ
"наоборот, ужесточает санкции против отказывающихся (", а-ля ,мексиканский вариант).,1990,художественная,роман,"Насколько я поняла ― сейчас в Верховной раде лежат два законопроекта по вакцинации: один закрепляет добровольность в отношении прививок, другой ― наоборот, ужесточает санкции против отказывающихся ( а-ля мексиканский вариант). [Борис Левин. Блуждающие огни (1995)] [омонимия не снята]",PRTF,ADJF
"ну, грибочки- то, грузди- то", а-ля ,рюс? ,1940,нехудожественная,"дневник, записные книжки","А вот это ты пробовал, ну, грибочки- то, грузди- то а-ля рюс?  [Василий Катанян. Лоскутное одеяло (1943-1949)] [омонимия не снята]",CONJ,UNKN
то есть не писать картину, а-ля ,"рембрандт, а-ля рубенс и",1920,художественная,рассказ,"Для успеха в этом мне надо было совершенно оставить все правила и манеры, двенадцатилетним копированием в Эрмитаже приобретенные, а приняться за средства, употребляемые Гранетом, ― и они мне открылись в самом простом виде, состоящем в том, чтобы ничего не изображать иначе, чем в натуре является, и повиноваться ей одной, без примеси манеры какого-либо художника, то есть не писать картину а-ля Рембрандт, а-ля Рубенс и [А. С. Грин. Блистающий мир (1923)] [омонимия не снята]",NOUN,NOUN
балетные скинут и давай выплясывать, а-ля ,натюрель.,2000,нехудожественная,мемуары,"Особливо когда его сиятельство знак им особый подаст ― так сейчас же пастушки его крепостные одежды свои балетные скинут и давай выплясывать а-ля натюрель. [Герард Васильев. Роли, которые нас выбирают (2002)] [омонимия не снята]",INFN,NOUN
1997 году деревянное бревенчатое здание, а-ля ,"рюс, но без пошлых витиеватостей, красноватое, ",2000,нехудожественная,статья,"Это построенное в 1997 году деревянное бревенчатое здание а-ля рюс, но без пошлых витиеватостей, красноватое, пахнущее деревом, смолой, чаем из самовара, медом, травами, полотенцами. [Лариса Кислинская. Не верь, не бойся, не проси // «Совершенно секретно», 2003.03.02] [омонимия не снята]",NOUN,UNKN
по последней моде и причесанным, а-ля ,капуль,1990,нехудожественная,статья,"Последний, еще двадцатилетним малым, сперва ходил в картузе и поддевке, по-купечески, раза три со стариком Рошфором ездил в Париж за « модьем», но после третьей поездки, продолжавшейся около двух месяцев, так как Рошфор там с месяц прохворал и месяц отдыхал после болезни, вместо « Ванятки» в картузе бородатым, в долгополом сюртуке родитель увидал своего единственного сына франтом, одетым по последней моде и причесанным а-ля Капуль [Архангельские мужики // «Профессионал», 1998.07.01] [омонимия не снята]",PRTF,NOUN
"с вами, девица выгибает кисть «", а-ля ,"лебедь», вскидывая ее так высоко, что ",1980,художественная,пьеса,"Здороваясь с вами, девица выгибает кисть « а-ля лебедь», вскидывая ее так высоко, что вам приходится либо легонько отпрянуть, либо уж невольно приложиться к ручке… [Венедикт Ерофеев. Вальпургиева ночь, или Шаги командора (1985)] [омонимия не снята]",NOUN,NOUN
дополняющее тёмные усы и эспаньолку, а-ля ,"анри катр"", ― типичного монпарнасского интеллектуала, завсегдатая "" ",2010,художественная,повесть,"мягким козырьком вроде той, которую так недолго нашивал Керенский, но зато хорошо дополняющее тёмные усы и эспаньолку а-ля ""Анри катр"", ― типичного монпарнасского интеллектуала, завсегдатая "" Ротонды"" или "" Клозери де Лила"", знатока всех видов изящных искусств, в особенности итальянского Возрождения, блестящего оратора, умевшего без подготовки, экспромтом, говорить на любую тему подряд два часа, ни разу не запнувшись и не запутавшись в слишком длинных придаточных предложениях.   [Татьяна Соломатина. Девять месяцев, или «Комедия женских положений» (2010)] [омонимия не снята]",NOUN,NOUN
"или алебарды, а затем принимается", а-ля ,жан маре скакать по столам и ,2000,нехудожественная,интервью,"Говорили, что он приводит противника в свою лабораторию, предлагает на выбор рапиры, шпаги или алебарды, а затем принимается а-ля Жан Маре скакать по столам и опрокидывать шкафы. [Лариса Малюкова. Разговор поэтов о киноторговле // «Искусство кино», 2003.06.30] [омонимия не снята]",VERB,NOUN
"кожаного пальто, перчаток и картуза «", а-ля ,"жириновский», примяв его затылком.",2000,нехудожественная,статья,"А он- то и валялся на моей кровати, не сняв кожаного пальто, перчаток и картуза « а-ля Жириновский», примяв его затылком. [Анна Ковалева. Чудовище ждать не будет. «Сегоднячко» запускает свое реальное шоу на ТНТ // «Известия», 2002.05.17] [омонимия не снята]",NOUN,NOUN
в очередной раз расхожий штамп, а-ля ,"по мнению британских учёных», то процент ",2000,нехудожественная,статья,"Но если посчитать статистику всерьёз, а не озвучить в очередной раз расхожий штамп а-ля «по мнению британских учёных», то процент писателей, выходящих из врачей, не так уж и велик. [Денис Морозов. Трусарди // «Карьера», 2000.02.01] [омонимия не снята]",NOUN,PREP
в клубе  « по максимуму» ― диваны, а-ля ,"филипп старк, старинные итальянские маски на ",2000,художественная,роман,"Зато все остальное в клубе  « по максимуму» ― диваны а-ля Филипп Старк, старинные итальянские маски на стенах и выложенные мозаикой столы.   [Ольга Некрасова. Платит последний (2000)] [омонимия не снята]",NOUN,NOUN
"с шапкой кудрявых волос, причёсанных", а-ля ,"титус, по крайней мере в юности.",2010,художественная,повесть,"При маленьком росте ключик был коренаст, крепок, с крупной красивой головой с шапкой кудрявых волос, причёсанных а-ля Титус, по крайней мере в юности. [Татьяна Соломатина. Девять месяцев, или «Комедия женских положений» (2010)] [омонимия не снята]",PRTF,NOUN
"спортивным вариантом « семейных» трусов ― обтягивающие,", а-ля ,"велосипедные, шорты до середины бедра, так ",1960,художественная,роман,"Если вы все-таки предпочитаете удлиненное белье, то можете воспользоваться спортивным вариантом « семейных» трусов ― обтягивающие, а-ля велосипедные, шорты до середины бедра, так называемые trunks. [В. П. Катаев. Трава забвенья (1964-1967)] [омонимия не снята]",PRTF,ADJF
"мордами доберман-пинчеров, гагарина в виде", а-ля ,"рюссного сладенького отрока, одинаковые страдальческие глаза ",2000,нехудожественная,форум,"Но когда Маша увидела убиенного царевича с так плохо нарисованным разрезанным горлом, что ее знание судебной медицины возмущенно восстало, богатырей- истуканов с тупыми ряшками комсомольских дружинников- каратистов в роли спасителей Отечества, опереточных королей с холеными мордами доберман-пинчеров, Гагарина в виде а-ля-рюссного сладенького отрока, одинаковые страдальческие глаза Алеши Карамазова и Джины Лоллобриджиды, сработанные на одном и том же конвейере, китчевое меню знаменитостей двадцатого [Красота, здоровье, отдых: Косметика и парфюм (форум) (2004)] [омонимия не снята]",NOUN,ADJF
и своих антисоветских чувств стесняться., а-ля ,"гер ком а-ля гер, тем более ",2000,художественная,роман,"и своих антисоветских чувств стесняться. А-ля гер ком а-ля гер, тем более что в истории СССР было много пренеприятных страниц и в советском повседневном быту тоже. [Валериан Скворцов. Каникулы вне закона (2001)] [омонимия не снята]",INFN,NOUN
"конце концов, небольшой кусочек забав", а-ля ,церетели в виду петропавловки не такой ,2000,нехудожественная,интервью,"В конце концов, небольшой кусочек забав а-ля Церетели в виду Петропавловки не такой уж плохой обмен на голы Халка и Кержакова.   [Светлана Писарская: «Москва по сравнению с Шанхаем выглядит глубокой нецивилизованной провинцией» // «Мир & Дом. City», 2003.09.15] [омонимия не снята]",NOUN,NOUN
